{
  "category": "心理学理论",
  "category_id": "01",
  "source_file": "../_PsychologyLib/01_心理学理论/心理学理论.md",
  "concept_count": 17,
  "parsed_at": "2026-08-24T03:31:51+08:00",
  "schema_version": "0.1.0",
  "concepts": [
    {
      "title": "什么是心理学",
      "section": "一、心理学基本概念",
      "level": 3,
      "raw": "**定义**：研究心理现象及其规律的科学研究\n\n**研究对象**：\n\n| 对象 | 说明 |\n|------|------|\n| 认知过程 | 感知、记忆、思维、想象 |\n| 情绪情感 | 情绪、情感、心境 |\n| 意志过程 | 决策、执行、自我控制 |\n| 个性心理 | 人格、能力、性格 |\n\n---",
      "first_definition": "研究心理现象及其规律的科学研究",
      "id": "01-001"
    },
    {
      "title": "心理学研究目标",
      "section": "一、心理学基本概念",
      "level": 3,
      "raw": "| 目标 | 说明 |\n|------|------|\n| 描述 | 描述心理现象 |\n| 解释 | 解释心理原因 |\n| 预测 | 预测心理行为 |\n| 控制 | 干预和改变行为 |\n\n---",
      "first_definition": "",
      "id": "01-002"
    },
    {
      "title": "构造主义",
      "section": "二、心理学主要流派",
      "level": 3,
      "raw": "**代表人物**：冯特、铁钦纳\n\n**核心观点**：\n- 意识可以分解为基本元素\n- 内省法是主要方法\n- 研究意识结构\n\n**贡献与局限**：\n- 建立第一个心理学实验室\n- 但内省法主观性强\n\n---",
      "first_definition": "",
      "id": "01-003"
    },
    {
      "title": "机能主义",
      "section": "二、心理学主要流派",
      "level": 3,
      "raw": "**代表人物**：詹姆斯、杜威\n\n**核心观点**：\n- 意识是流动的\n- 关注心理的功能\n- 适应环境影响\n\n**贡献**：\n- 推动应用心理学发展\n- 关注实际功能\n\n---",
      "first_definition": "",
      "id": "01-004"
    },
    {
      "title": "行为主义",
      "section": "二、心理学主要流派",
      "level": 3,
      "raw": "**代表人物**：华生、斯金纳\n\n**核心观点**：\n- 心理学应该研究可观察行为\n- 环境决定行为\n- 条件反射是学习基础\n\n**贡献与局限**：\n- 推动心理学科学化\n- 但忽视内部心理过程\n\n---",
      "first_definition": "",
      "id": "01-005"
    },
    {
      "title": "格式塔心理学",
      "section": "二、心理学主要流派",
      "level": 3,
      "raw": "**代表人物**：韦特海默、苛勒\n\n**核心观点**：\n- 整体大于部分之和\n- 知觉具有组织性\n- 顿悟是学习关键\n\n**贡献**：\n- 推动认知心理学发展\n- 强调整体知觉\n\n---",
      "first_definition": "",
      "id": "01-006"
    },
    {
      "title": "精神分析",
      "section": "二、心理学主要流派",
      "level": 3,
      "raw": "**代表人物**：弗洛伊德\n\n**核心观点**：\n- 潜意识决定行为\n- 人格结构：本我、自我、超我\n- 早期经验影响人格\n\n**贡献与批评**：\n- 揭示潜意识作用\n- 但难以科学验证\n\n---",
      "first_definition": "",
      "id": "01-007"
    },
    {
      "title": "人本主义心理学",
      "section": "二、心理学主要流派",
      "level": 3,
      "raw": "**代表人物**：马斯洛、罗杰斯\n\n**核心观点**：\n- 关注人的积极面\n- 自我实现是最高动机\n- 强调自由意志\n\n**贡献**：\n- 推动积极心理学\n- 关注人的价值\n\n---",
      "first_definition": "",
      "id": "01-008"
    },
    {
      "title": "认知心理学",
      "section": "二、心理学主要流派",
      "level": 3,
      "raw": "**代表人物**：奈瑟、西蒙\n\n**核心观点**：\n- 研究内部心理过程\n- 信息加工隐喻\n- 计算机模拟\n\n**贡献**：\n- 推动认知科学\n- 应用广泛\n\n---",
      "first_definition": "",
      "id": "01-009"
    },
    {
      "title": "生物心理学理论",
      "section": "三、现代心理学理论",
      "level": 3,
      "raw": "**核心观点**：\n- 心理活动的生物学基础\n- 神经科学方法\n- 进化心理学视角\n\n**研究内容**：\n- 脑与行为关系\n- 神经递质与行为\n- 进化适应行为\n\n---",
      "first_definition": "",
      "id": "01-010"
    },
    {
      "title": "社会文化理论",
      "section": "三、现代心理学理论",
      "level": 3,
      "raw": "**代表人物**：维果茨基\n\n**核心观点**：\n- 心理发展受社会文化影响\n- 文化工具中介心理过程\n- 社会互动促进发展\n\n**应用**：\n- 教育心理学\n- 跨文化心理学\n\n---",
      "first_definition": "",
      "id": "01-011"
    },
    {
      "title": "积极心理学理论",
      "section": "三、现代心理学理论",
      "level": 3,
      "raw": "**代表人物**：塞利格曼\n\n**核心观点**：\n- 关注人的优势和美德\n- 促进幸福感\n- 预防心理问题\n\n**研究内容**：\n- 积极情绪\n- 投入\n- 意义\n- 成就\n- 积极关系\n\n---",
      "first_definition": "",
      "id": "01-012"
    },
    {
      "title": "研究方法类型",
      "section": "四、心理学研究方法",
      "level": 3,
      "raw": "| 方法 | 说明 | 适用 |\n|------|------|------|\n| 实验法 | 控制变量 | 因果关系 |\n| 相关法 | 测量关系 | 预测 |\n| 观察法 | 自然观察 | 描述行为 |\n| 调查法 | 问卷调查 | 态度信念 |\n| 个案法 | 深入研究 | 特殊案例 |\n\n---",
      "first_definition": "",
      "id": "01-013"
    },
    {
      "title": "实验设计",
      "section": "四、心理学研究方法",
      "level": 3,
      "raw": "**类型**：\n\n| 类型 | 说明 |\n|------|------|\n| 被试内设计 | 同一被试接受所有条件 |\n| 被试间设计 | 不同被试接受不同条件 |\n| 混合设计 | 结合两种设计 |\n\n**控制变量**：\n- 随机分配\n- 匹配\n- 双盲实验\n\n---",
      "first_definition": "",
      "id": "01-014"
    },
    {
      "title": "主要流派",
      "section": "五、心理学理论速查",
      "level": 3,
      "raw": "| 流派 | 代表 | 核心观点 |\n|------|------|----------|\n| 构造主义 | 冯特 | 分解意识元素 |\n| 机能主义 | 詹姆斯 | 意识功能 |\n| 行为主义 | 华生 | 研究可观察行为 |\n| 格式塔 | 韦特海默 | 整体大于部分 |\n| 精神分析 | 弗洛伊德 | 潜意识决定行为 |\n| 人本主义 | 马斯洛 | 自我实现 |\n| 认知心理学 | 奈瑟 | 信息加工 |",
      "first_definition": "",
      "id": "01-015"
    },
    {
      "title": "研究领域",
      "section": "五、心理学理论速查",
      "level": 3,
      "raw": "| 领域 | 研究内容 |\n|------|----------|\n| 认知心理学 | 知觉、记忆、思维 |\n| 发展心理学 | 毕生发展 |\n| 社会心理学 | 社会影响 |\n| 临床心理学 | 心理障碍与治疗 |\n| 人格心理学 | 人格理论 |\n| 积极心理学 | 幸福感、优势 |",
      "first_definition": "",
      "id": "01-016"
    },
    {
      "title": "研究方法",
      "section": "五、心理学理论速查",
      "level": 3,
      "raw": "| 方法 | 优点 | 缺点 |\n|------|------|------|\n| 实验法 | 因果结论 | 人工环境 |\n| 相关法 | 自然情境 | 不能因果 |\n| 观察法 | 真实行为 | 主观解释 |\n| 调查法 | 大样本 | 自我报告偏差 |",
      "first_definition": "",
      "id": "01-017"
    }
  ]
}