{
  "category": "人格心理学",
  "category_id": "06",
  "source_file": "../_PsychologyLib/06_人格心理学/人格心理学.md",
  "concept_count": 23,
  "parsed_at": "2026-08-24T03:31:51+08:00",
  "schema_version": "0.1.0",
  "concepts": [
    {
      "title": "什么是人格",
      "section": "一、人格心理学基本概念",
      "level": 3,
      "raw": "**定义**：稳定的行为模式和内在体验特点\n\n**特征**：\n\n| 特征 | 说明 |\n|------|------|\n| 稳定性 | 跨时间稳定 |\n| 差异性 | 人与人不同 |\n| 整体性 | 人格是整体 |\n| 适应性 | 人格帮助适应 |\n\n---",
      "first_definition": "稳定的行为模式和内在体验特点",
      "id": "06-001"
    },
    {
      "title": "人格研究层次",
      "section": "一、人格心理学基本概念",
      "level": 3,
      "raw": "| 层次 | 说明 |\n|------|------|\n| 人格特质 | 稳定的行为倾向 |\n| 人格动力 | 动机、目标、价值 |\n| 人格发展 | 人格如何发展变化 |\n| 人格评估 | 如何测量人格 |\n\n---",
      "first_definition": "",
      "id": "06-002"
    },
    {
      "title": "奥尔波特的特质理论",
      "section": "二、特质理论",
      "level": 3,
      "raw": "**特质类型**：\n\n| 类型 | 说明 | 例子 |\n|------|------|-------|\n| 首要特质 | 支配整个人格 |  Gandhi 的非暴力 |\n| 中心特质 | 构成人格核心 | 诚实、善良 |\n| 次要特质 | 特定情境表现 | 特定偏好 |\n\n---",
      "first_definition": "",
      "id": "06-003"
    },
    {
      "title": "卡特尔的16因素模型",
      "section": "二、特质理论",
      "level": 3,
      "raw": "**16种根源特质**：\n- A：乐群性\n- B：聪慧性\n- C：情绪稳定性\n- E：恃强性\n- F：兴奋性\n- G：有恒性\n- H：敢为性\n- I：敏感性\n- L：怀疑性\n- M：幻想性\n- N：世故性\n- O：忧虑性\n- Q1：实验性\n- Q2：独立性\n- Q3：自律性\n- Q4：紧张性\n\n---",
      "first_definition": "",
      "id": "06-004"
    },
    {
      "title": "大五人格模型（OCEAN）",
      "section": "二、特质理论",
      "level": 3,
      "raw": "**五个维度**：\n\n| 维度 | 高分特征 | 低分特征 |\n|------|----------|----------|\n| 开放性（Openness） | 好奇、创意 | 传统、保守 |\n| 尽责性（Conscientiousness） | 有组织、可靠 | 随意、不可靠 |\n| 外向性（Extraversion） | 社交、活跃 | 内向、安静 |\n| 宜人性（Agreeableness） | 合作、利他 | 批判、敌对 |\n| 神经质（Neuroticism） | 焦虑、情绪波动 | 冷静、情绪稳定 |\n\n**应用**：\n- 人事选拔\n- 职业指导\n- 心理健康预测\n\n---",
      "first_definition": "",
      "id": "06-005"
    },
    {
      "title": "弗洛伊德的人格结构",
      "section": "三、心理动力学理论",
      "level": 3,
      "raw": "**三我结构**：\n\n| 结构 | 原则 | 特征 |\n|------|------|------|\n| 本我 | 快乐原则 | 本能冲动 |\n| 自我 | 现实原则 | 调节本我超我 |\n| 超我 | 道德原则 | 良心、理想 |\n\n---",
      "first_definition": "",
      "id": "06-006"
    },
    {
      "title": "弗洛伊德的人格发展",
      "section": "三、心理动力学理论",
      "level": 3,
      "raw": "**心理性发展阶段**：\n\n| 阶段 | 年龄 | 冲突 |\n|------|------|------|\n| 口腔期 | 0-18月 | 断奶 |\n| 肛门期 | 18月-3岁 | 如厕训练 |\n| 性器期 | 3-6岁 | 俄狄浦斯情结 |\n| 潜伏期 | 6岁-青春期 | 性冲动潜伏 |\n| 生殖期 | 青春期+ | 成熟性爱 |\n\n**固着**：\n- 过度满足或挫折导致固着\n- 成年后表现相应阶段特征\n\n---",
      "first_definition": "",
      "id": "06-007"
    },
    {
      "title": "荣格的分析心理学",
      "section": "三、心理动力学理论",
      "level": 3,
      "raw": "**核心概念**：\n\n| 概念 | 说明 |\n|------|------|\n| 集体无意识 | 人类共有无意识 |\n| 原型 | 无意识中的普遍意象 |\n| 人格面具 | 社会角色 |\n| 阴影 | 被压抑的部分 |\n| 阿尼玛/阿尼姆斯 | 男性中的女性意象/女性中的男性意象 |\n| 自性 | 整体人格 |\n\n**心理类型**：\n- 态度类型：内倾 vs 外倾\n- 功能类型：思维、情感、感觉、直觉\n\n---",
      "first_definition": "",
      "id": "06-008"
    },
    {
      "title": "阿德勒的个体心理学",
      "section": "三、心理动力学理论",
      "level": 3,
      "raw": "**核心概念**：\n- 自卑与补偿\n- 追求优越\n- 生活风格\n- 社会兴趣\n\n---",
      "first_definition": "",
      "id": "06-009"
    },
    {
      "title": "马斯洛的自我实现理论",
      "section": "四、人本主义理论",
      "level": 3,
      "raw": "**需要层次**：\n\n| 层次 | 需要 |\n|------|------|\n| 自我实现 | 实现潜能 |\n| 尊重需要 | 自尊、他尊 |\n| 归属与爱 | 友谊、爱情 |\n| 安全需要 | 安全、稳定 |\n| 生理需要 | 食物、水、性 |\n\n**自我实现者特征**：\n- 准确感知现实\n- 接纳自己他人\n- 自发自然\n- 问题中心而非自我中心\n- 超然独立\n- 欣赏生活\n- 高峰体验\n\n---",
      "first_definition": "",
      "id": "06-010"
    },
    {
      "title": "罗杰斯的自我理论",
      "section": "四、人本主义理论",
      "level": 3,
      "raw": "**核心概念**：\n- 自我概念\n- 理想自我与现实自我\n- 无条件积极关注\n- 条件化积极关注\n\n**心理健康**：\n- 开放经验\n- 存在主义生活方式\n- 有机体信任\n- 经验与自我一致\n\n---",
      "first_definition": "",
      "id": "06-011"
    },
    {
      "title": "班杜拉的社会认知理论",
      "section": "五、认知社会学习理论",
      "level": 3,
      "raw": "**核心概念**：\n- 观察学习\n- 自我效能感\n- 交互决定论（人、环境、行为）\n\n**自我效能感来源**：\n- 亲身成就\n- 替代经验\n- 言语说服\n- 情绪生理状态\n\n---",
      "first_definition": "",
      "id": "06-012"
    },
    {
      "title": "米歇尔的认知情感人格系统",
      "section": "五、认知社会学习理论",
      "level": 3,
      "raw": "**核心观点**：\n- 人格是认知情感系统\n- 情境差异导致行为差异\n- 人格需要综合认知情感理解\n\n---",
      "first_definition": "",
      "id": "06-013"
    },
    {
      "title": "自陈量表",
      "section": "六、人格评估",
      "level": 3,
      "raw": "**优点**：\n- 容易施测\n- 评分客观\n\n**缺点**：\n- 社会赞许性偏差\n- 自我防御\n- 文化差异\n\n**常用量表**：\n- MMPI（明尼苏达多相人格量表）\n- NEO-PI（大五人格量表）\n- EPQ（艾森克人格问卷）\n\n---",
      "first_definition": "",
      "id": "06-014"
    },
    {
      "title": "投射测验",
      "section": "六、人格评估",
      "level": 3,
      "raw": "**优点**：\n- 绕过防御\n- 揭示无意识\n\n**缺点**：\n- 评分主观\n- 信效度较低\n\n**常用测验**：\n- Rorschach 墨迹测验\n- TAT（主题统觉测验）\n- 句子完成测验\n\n---",
      "first_definition": "",
      "id": "06-015"
    },
    {
      "title": "行为评估",
      "section": "六、人格评估",
      "level": 3,
      "raw": "**方法**：\n- 行为观察\n- 行为评定\n- 情境测试\n\n**优点**：\n- 直接观察行为\n- 生态效度高\n\n---",
      "first_definition": "",
      "id": "06-016"
    },
    {
      "title": "人事选拔",
      "section": "七、人格心理学应用",
      "level": 3,
      "raw": "**应用**：\n- 人格测验预测工作绩效\n- 大五人格与工作适应\n- 诚信测验预测反生产行为\n\n---",
      "first_definition": "",
      "id": "06-017"
    },
    {
      "title": "职业指导",
      "section": "七、人格心理学应用",
      "level": 3,
      "raw": "**应用**：\n- 人格与职业匹配\n- 霍兰德职业兴趣理论\n- 人格指导职业选择\n\n---",
      "first_definition": "",
      "id": "06-018"
    },
    {
      "title": "心理健康",
      "section": "七、人格心理学应用",
      "level": 3,
      "raw": "**应用**：\n- 人格预测心理健康\n- 神经质预测抑郁焦虑\n- 尽责性预测健康行为\n\n---",
      "first_definition": "",
      "id": "06-019"
    },
    {
      "title": "人际关系",
      "section": "七、人格心理学应用",
      "level": 3,
      "raw": "**应用**：\n- 人格影响人际吸引\n- 相似性吸引\n- 互补性吸引\n\n---",
      "first_definition": "",
      "id": "06-020"
    },
    {
      "title": "人格理论",
      "section": "八、人格心理学速查",
      "level": 3,
      "raw": "| 理论 | 代表 | 核心观点 |\n|------|------|----------|\n| 特质理论 | 卡特尔、麦克雷 | 人格由特质构成 |\n| 心理动力学 | 弗洛伊德、荣格 | 无意识驱动行为 |\n| 人本主义 | 马斯洛、罗杰斯 | 自我实现是核心 |\n| 认知社会学习 | 班杜拉、米歇尔 | 认知与社会学习 |",
      "first_definition": "",
      "id": "06-021"
    },
    {
      "title": "大五人格",
      "section": "八、人格心理学速查",
      "level": 3,
      "raw": "| 维度 | 高分 | 低分 |\n|------|------|------|\n| 开放性 | 好奇创意 | 传统保守 |\n| 尽责性 | 有组织可靠 | 随意不可靠 |\n| 外向性 | 社交活跃 | 内向安静 |\n| 宜人性 | 合作利他 | 批判敌对 |\n| 神经质 | 焦虑情绪波动 | 冷静稳定 |",
      "first_definition": "",
      "id": "06-022"
    },
    {
      "title": "人格评估",
      "section": "八、人格心理学速查",
      "level": 3,
      "raw": "| 方法 | 优点 | 缺点 |\n|------|------|------|\n| 自陈量表 | 容易施测、评分客观 | 社会赞许性偏差 |\n| 投射测验 | 绕过防御 | 评分主观、信效度低 |\n| 行为评估 | 直接观察、生态效度高 | 费时、情境限制 |",
      "first_definition": "",
      "id": "06-023"
    }
  ]
}