{
  "category": "心理测量",
  "category_id": "09",
  "source_file": "../_PsychologyLib/09_心理测量/心理测量.md",
  "concept_count": 23,
  "parsed_at": "2026-08-24T03:31:51+08:00",
  "schema_version": "0.1.0",
  "concepts": [
    {
      "title": "什么是心理测量",
      "section": "一、心理测量基本概念",
      "level": 3,
      "raw": "**定义**：使用测验工具量化心理特征的过程\n\n**测量对象**：\n\n| 对象 | 说明 |\n|------|------|\n| 能力 | 智力、特殊能力 |\n| 人格 | 人格特质、态度 |\n| 成就 | 知识技能掌握 |\n| 态度 | 态度、兴趣、价值观 |\n\n---",
      "first_definition": "使用测验工具量化心理特征的过程",
      "id": "09-001"
    },
    {
      "title": "测验类型",
      "section": "一、心理测量基本概念",
      "level": 3,
      "raw": "| 类型 | 说明 | 例子 |\n|------|------|-------|\n| 能力测验 | 测量能力 | 智力测验、能力倾向测验 |\n| 成就测验 | 测量学习结果 | 学业考试、职业资格 |\n| 人格测验 | 测量人格特质 | MMPI、EPQ |\n| 态度测验 | 测量态度兴趣 | 兴趣测验、价值观测验 |\n\n---",
      "first_definition": "",
      "id": "09-002"
    },
    {
      "title": "测验编制步骤",
      "section": "二、测验编制",
      "level": 3,
      "raw": "| 步骤 | 说明 |\n|------|------|\n| 1. 确定目的 | 明确测量什么 |\n| 2. 定义构念 | 理论定义 |\n| 3. 编制题目 | 题目编写 |\n| 4. 预试 | 小样本测试 |\n| 5. 题目分析 | 难度、区分度 |\n| 6. 标准化 | 建立常模 |\n| 7. 信效度检验 | 检验质量 |\n| 8. 出版使用 | 正式使用 |\n\n---",
      "first_definition": "",
      "id": "09-003"
    },
    {
      "title": "题目类型",
      "section": "二、测验编制",
      "level": 3,
      "raw": "| 类型 | 优点 | 缺点 |\n|------|------|------|\n| 选择题 | 评分客观、覆盖广 | 猜测因素 |\n| 是非题 | 简单、评分客观 | 猜测因素大 |\n| 填空题 | 避免猜测 | 评分主观 |\n| 论述题 | 测量高级思维 | 评分主观、覆盖窄 |\n| 投射题 | 测量潜意识 | 信效度低 |\n\n---",
      "first_definition": "",
      "id": "09-004"
    },
    {
      "title": "题目分析",
      "section": "二、测验编制",
      "level": 3,
      "raw": "**难度**（P值）：\n- P = 答对人数 / 总人数\n- 理想难度：0.5（选择题）\n\n**区分度**（D值）：\n- 高分组通过率 - 低分组通过率\n- D > 0.3 为良好题目\n\n---",
      "first_definition": "",
      "id": "09-005"
    },
    {
      "title": "信度（Reliability）",
      "section": "三、测验质量指标",
      "level": 3,
      "raw": "**定义**：测验结果的一致性、稳定性\n\n**类型**：\n\n| 类型 | 计算方法 | 适用 |\n|------|----------|------|\n| 重测信度 | 同一测验两次相关 | 稳定性 |\n| 复本信度 | 两个复本相关 | 等值性 |\n| 内部一致性信度 | Cronbach's α | 同质性 |\n| 评分者信度 | 评分者间相关 | 主观评分 |\n\n**标准**：\n- 能力测验：α > 0.8\n- 人格测验：α > 0.7\n- 研究工具：α > 0.6\n\n---",
      "first_definition": "测验结果的一致性、稳定性",
      "id": "09-006"
    },
    {
      "title": "效度（Validity）",
      "section": "三、测验质量指标",
      "level": 3,
      "raw": "**定义**：测验测量到想要测量的程度\n\n**类型**：\n\n| 类型 | 说明 | 证据 |\n|------|------|------|\n| 内容效度 | 题目代表内容 | 专家判断 |\n| 效标关联效度 | 与效标相关 | 同时效度、预测效度 |\n| 结构效度 | 测量理论构念 | 因素分析、多质多法 |\n\n---",
      "first_definition": "测验测量到想要测量的程度",
      "id": "09-007"
    },
    {
      "title": "信度与效度关系",
      "section": "三、测验质量指标",
      "level": 3,
      "raw": "**关系**：\n- 信度是效度的必要条件\n- 信度高，效度不一定高\n- 效度高，信度一定高\n\n**公式**：\n- 效度上限 = √(信度)\n\n---",
      "first_definition": "",
      "id": "09-008"
    },
    {
      "title": "智力测验",
      "section": "四、常用心理测验",
      "level": 3,
      "raw": "**斯坦福-比奈智力量表**：\n- 年龄量表\n- 比率智商：IQ = MA/CA × 100\n\n**韦氏智力量表**：\n- 言语量表 + 操作量表\n- 离差智商：IQ = 100 + 15Z\n\n**瑞文推理测验**：\n- 非言语智力测验\n- 测量流体智力\n\n---",
      "first_definition": "",
      "id": "09-009"
    },
    {
      "title": "人格测验",
      "section": "四、常用心理测验",
      "level": 3,
      "raw": "**明尼苏达多相人格量表（MMPI）**：\n- 临床量表：10个\n- 效度量表：3个（说谎、装坏、防御）\n- 解释：剖面图分析\n\n**艾森克人格问卷（EPQ）**：\n- 三个维度：E（外向）、N（神经质）、P（精神质）\n- 简化版：EPQ-R\n\n**大五人格量表（NEO-PI）**：\n- O、C、E、A、N五个维度\n- 每个维度6个侧面\n\n---",
      "first_definition": "",
      "id": "09-010"
    },
    {
      "title": "临床测验",
      "section": "四、常用心理测验",
      "level": 3,
      "raw": "**贝克抑郁量表（BDI）**：\n- 21个项目\n- 0-3评分\n- 总分：0-13无抑郁，14-19轻度，20-28中度，29-63重度\n\n**状态-特质焦虑量表（STAI）**：\n- 状态焦虑：当前焦虑\n- 特质焦虑：一贯焦虑倾向\n\n**创伤后应激障碍量表（PCL）**：\n- 17个项目（DSM-IV）\n- 20个项目（DSM-5）\n\n---",
      "first_definition": "",
      "id": "09-011"
    },
    {
      "title": "职业测验",
      "section": "四、常用心理测验",
      "level": 3,
      "raw": "**霍兰德职业兴趣量表**：\n- 六个类型：R、I、A、S、E、C\n- 人格-环境匹配\n\n**一般能力倾向测验（GATB）**：\n- 8个分测验\n- 12个因素\n\n---",
      "first_definition": "",
      "id": "09-012"
    },
    {
      "title": "伦理原则",
      "section": "五、测验使用伦理",
      "level": 3,
      "raw": "| 原则 | 说明 |\n|------|------|\n| 专业责任 | 专业人员使用 |\n| 保密原则 | 结果保密 |\n| 知情同意 | 告知测验目的 |\n| 避免伤害 | 不造成伤害 |\n| 公平使用 | 不歧视 |\n\n---",
      "first_definition": "",
      "id": "09-013"
    },
    {
      "title": "常见伦理问题",
      "section": "五、测验使用伦理",
      "level": 3,
      "raw": "| 问题 | 说明 |\n|------|------|\n| 测验误用 | 不适当使用 |\n| 结果误解 | 错误解释 |\n| 文化偏见 | 文化不公平 |\n| 标签效应 | 标签化伤害 |\n\n---",
      "first_definition": "",
      "id": "09-014"
    },
    {
      "title": "教育领域",
      "section": "六、心理测量应用",
      "level": 3,
      "raw": "**应用**：\n- 学业评估\n- 特殊儿童鉴别\n- 教学评估\n\n**注意**：\n- 避免单一评价\n- 多元评价\n\n---",
      "first_definition": "",
      "id": "09-015"
    },
    {
      "title": "临床领域",
      "section": "六、心理测量应用",
      "level": 3,
      "raw": "**应用**：\n- 心理诊断\n- 治疗评估\n- 康复评估\n\n**注意**：\n- 结合临床访谈\n- 动态评估\n\n---",
      "first_definition": "",
      "id": "09-016"
    },
    {
      "title": "人事领域",
      "section": "六、心理测量应用",
      "level": 3,
      "raw": "**应用**：\n- 人员选拔\n- 岗位匹配\n- 培训评估\n\n**注意**：\n- 合法合规\n- 不歧视\n\n---",
      "first_definition": "",
      "id": "09-017"
    },
    {
      "title": "项目反应理论（IRT）",
      "section": "七、心理测量发展趋势",
      "level": 3,
      "raw": "**优势**：\n- 题目参数不变\n- 计算机自适应测验\n- 精确测量\n\n---",
      "first_definition": "",
      "id": "09-018"
    },
    {
      "title": "计算机自适应测验（CAT）",
      "section": "七、心理测量发展趋势",
      "level": 3,
      "raw": "**优点**：\n- 个性化测试\n- 效率高\n- 精度高\n\n---",
      "first_definition": "",
      "id": "09-019"
    },
    {
      "title": "动态评估",
      "section": "七、心理测量发展趋势",
      "level": 3,
      "raw": "**特点**：\n- 关注学习潜能\n- 干预-测量结合\n- 过程导向\n\n---",
      "first_definition": "",
      "id": "09-020"
    },
    {
      "title": "测验质量",
      "section": "八、心理测量速查",
      "level": 3,
      "raw": "| 指标 | 定义 | 标准 |\n|------|------|------|\n| 信度 | 一致性 | > 0.7-0.8 |\n| 效度 | 准确性 | > 0.7 |\n| 难度 | 题目难易 | 0.5（选择题） |\n| 区分度 | 区分能力 | > 0.3 |",
      "first_definition": "",
      "id": "09-021"
    },
    {
      "title": "常用测验",
      "section": "八、心理测量速查",
      "level": 3,
      "raw": "| 测验 | 测量 | 应用 |\n|------|------|------|\n| 韦氏量表 | 智力 | 临床诊断 |\n| MMPI | 人格病理 | 临床评估 |\n| EPQ | 人格维度 | 研究、人事 |\n| BDI | 抑郁 | 临床、研究 |\n| 霍兰德 | 职业兴趣 | 职业指导 |",
      "first_definition": "",
      "id": "09-022"
    },
    {
      "title": "伦理原则",
      "section": "八、心理测量速查",
      "level": 3,
      "raw": "| 原则 | 说明 |\n|------|------|\n| 专业责任 | 专业人员使用 |\n| 保密 | 结果保密 |\n| 知情同意 | 告知目的 |\n| 避免伤害 | 不造成伤害 |\n| 公平 | 不歧视 |",
      "first_definition": "",
      "id": "09-023"
    }
  ]
}