{
  "category": "认知心理学",
  "category_id": "02",
  "source_file": "../_PsychologyLib/02_认知心理学/认知心理学.md",
  "concept_count": 22,
  "parsed_at": "2026-08-24T03:31:51+08:00",
  "schema_version": "0.1.0",
  "concepts": [
    {
      "title": "什么是认知心理学",
      "section": "一、认知心理学基本概念",
      "level": 3,
      "raw": "**定义**：研究内部心理过程的心理学分支\n\n**研究内容**：\n\n| 内容 | 说明 |\n|------|------|\n| 知觉 | 信息接收和解释 |\n| 注意 | 信息选择 |\n| 记忆 | 信息存储和提取 |\n| 思维 | 问题解决、决策 |\n| 语言 | 语言理解产生 |\n| 学习 | 知识技能获得 |\n\n---",
      "first_definition": "研究内部心理过程的心理学分支",
      "id": "02-001"
    },
    {
      "title": "信息加工模型",
      "section": "一、认知心理学基本概念",
      "level": 3,
      "raw": "**核心观点**：\n- 人脑像计算机\n- 信息输入→加工→输出\n- 强调加工过程\n\n**模型组成**：\n\n| 组件 | 功能 |\n|------|------|\n| 感觉登记 | 短暂存储感觉信息 |\n| 工作记忆 | 当前意识内容 |\n| 长时记忆 | 永久知识存储 |\n| 执行控制 | 注意和策略选择 |\n\n---",
      "first_definition": "",
      "id": "02-002"
    },
    {
      "title": "知觉组织原则",
      "section": "二、知觉",
      "level": 3,
      "raw": "**格式塔原则**：\n\n| 原则 | 说明 |\n|------|------|\n| 接近性 | 接近的刺激被知觉为整体 |\n| 相似性 | 相似的刺激被知觉为整体 |\n| 连续性 | 连续的模式被知觉为整体 |\n| 封闭性 | 不完整图形被补全 |\n| 对称性 | 对称图形被知觉为整体 |\n\n---",
      "first_definition": "",
      "id": "02-003"
    },
    {
      "title": "知觉恒常性",
      "section": "二、知觉",
      "level": 3,
      "raw": "**类型**：\n\n| 类型 | 说明 |\n|------|------|\n| 大小恒常性 | 距离变化，大小知觉不变 |\n| 形状恒常性 | 角度变化，形状知觉不变 |\n| 亮度恒常性 | 光照变化，亮度知觉不变 |\n| 颜色恒常性 | 光照变化，颜色知觉不变 |\n\n---",
      "first_definition": "",
      "id": "02-004"
    },
    {
      "title": "注意类型",
      "section": "三、注意",
      "level": 3,
      "raw": "| 类型 | 说明 | 例子 |\n|------|------|-------|\n| 选择性注意 | 选择部分信息 | 鸡尾酒会效应 |\n| 分配性注意 | 同时处理多任务 | 边开车边聊天 |\n| 持续性注意 | 长时间保持注意 | 监视雷达 |\n| 执行性注意 | 控制认知过程 | 解决冲突任务 |\n\n---",
      "first_definition": "",
      "id": "02-005"
    },
    {
      "title": "注意理论",
      "section": "三、注意",
      "level": 3,
      "raw": "**过滤器理论**（布罗德本特）：\n- 信息经过过滤器\n- 只有部分信息被加工\n\n**衰减理论**（特瑞斯曼）：\n- 信息不是被过滤，而是被衰减\n- 重要信息仍能通过\n\n**资源限制理论**（卡尼曼）：\n- 注意是有限资源\n- 任务竞争注意资源\n\n---",
      "first_definition": "",
      "id": "02-006"
    },
    {
      "title": "记忆系统",
      "section": "四、记忆",
      "level": 3,
      "raw": "**三类记忆模型**：\n\n| 记忆 | 容量 | 持续时间 | 编码方式 |\n|------|------|----------|----------|\n| 感觉登记 | 很大 | 极短（毫秒） | 感觉形式 |\n| 工作记忆 | 有限（7±2） | 短（秒-分） | 语音、视觉 |\n| 长时记忆 | 无限 | 长（分-终身） | 语义、情节 |\n\n---",
      "first_definition": "",
      "id": "02-007"
    },
    {
      "title": "工作记忆",
      "section": "四、记忆",
      "level": 3,
      "raw": "**巴德利模型**：\n\n| 组件 | 功能 |\n|------|------|\n| 中央执行系统 | 注意控制 |\n| 语音环路 | 语音信息保持 |\n| 视空间模板 | 视觉空间信息保持 |\n| 情景缓冲器 | 整合多模态信息 |\n\n---",
      "first_definition": "",
      "id": "02-008"
    },
    {
      "title": "长时记忆",
      "section": "四、记忆",
      "level": 3,
      "raw": "**类型**：\n\n| 类型 | 说明 | 例子 |\n|------|------|-------|\n| 陈述性记忆 | 事实和事件 | 巴黎是法国首都 |\n| 程序性记忆 | 技能和习惯 | 骑车、游泳 |\n| 语义记忆 | 一般知识 | 概念、原理 |\n| 情节记忆 | 个人经历 | 昨天吃了什么 |\n\n---",
      "first_definition": "",
      "id": "02-009"
    },
    {
      "title": "遗忘",
      "section": "四、记忆",
      "level": 3,
      "raw": "**遗忘理论**：\n\n| 理论 | 核心观点 |\n|------|----------|\n| 衰退理论 | 记忆痕迹随时间消退 |\n| 干扰理论 | 新旧信息相互干扰 |\n| 提取失败理论 | 编码-提取条件不匹配 |\n| 动机性遗忘 | 防御机制压抑痛苦记忆 |\n\n---",
      "first_definition": "",
      "id": "02-010"
    },
    {
      "title": "问题解决",
      "section": "五、思维",
      "level": 3,
      "raw": "**问题空间**：\n- 初始状态\n- 目标状态\n- 算子（操作）\n\n**解决策略**：\n\n| 策略 | 说明 |\n|------|------|\n| 算法 | 系统尝试所有可能 |\n| 启发法 | 经验规则 |\n| 手段-目的分析 | 缩小当前状态与目标状态差距 |\n| 逆向搜索 | 从目标倒推 |\n\n---",
      "first_definition": "",
      "id": "02-011"
    },
    {
      "title": "决策",
      "section": "五、思维",
      "level": 3,
      "raw": "**决策理论**：\n\n| 理论 | 核心观点 |\n|------|----------|\n| 期望效用理论 | 理性选择期望效用最大 |\n| 前景理论 | 损失厌恶、确定性效应 |\n| 启发法 | 可用性、代表性、锚定 |\n\n**决策偏差**：\n- 过度自信\n- 后见之明偏差\n- 框架效应\n- 沉没成本谬误\n\n---",
      "first_definition": "",
      "id": "02-012"
    },
    {
      "title": "语言结构",
      "section": "六、语言",
      "level": 3,
      "raw": "| 层次 | 说明 |\n|------|------|\n| 语音 | 声音系统 |\n| 形态 | 词的结构 |\n| 句法 | 句子结构 |\n| 语义 | 意义 |\n| 语用 | 使用情境 |\n\n---",
      "first_definition": "",
      "id": "02-013"
    },
    {
      "title": "语言理解",
      "section": "六、语言",
      "level": 3,
      "raw": "**词汇理解**：\n- 心理词典\n- 激活扩散模型\n\n**句子理解**：\n- 句法分析\n- 语义分析\n\n**语篇理解**：\n- 情境模型\n- 推理\n\n---",
      "first_definition": "",
      "id": "02-014"
    },
    {
      "title": "学习类型",
      "section": "七、学习",
      "level": 3,
      "raw": "| 类型 | 说明 | 例子 |\n|------|------|-------|\n| 经典条件反射 | 刺激-反应联结 | 巴甫洛夫实验 |\n| 操作条件反射 | 行为-后果联结 | 斯金纳箱 |\n| 观察学习 | 观察他人学习 | 班杜拉实验 |\n| 认知学习 | 形成认知结构 | 顿悟学习 |\n\n---",
      "first_definition": "",
      "id": "02-015"
    },
    {
      "title": "知识表征",
      "section": "七、学习",
      "level": 3,
      "raw": "**表征方式**：\n\n| 方式 | 说明 |\n|------|------|\n| 命题 | 抽象知识单元 |\n| 图式 | 知识结构 |\n| 心理模型 | 情境理解 |\n| 类比 | 迁移学习 |\n\n---",
      "first_definition": "",
      "id": "02-016"
    },
    {
      "title": "教育应用",
      "section": "八、认知心理学应用",
      "level": 3,
      "raw": "**原则**：\n- 激活先前知识\n- 提供组织良好的材料\n- 促进深加工\n- 提供反馈\n\n---",
      "first_definition": "",
      "id": "02-017"
    },
    {
      "title": "人机交互",
      "section": "八、认知心理学应用",
      "level": 3,
      "raw": "**原则**：\n- 符合心理模型\n- 减少认知负荷\n- 提供反馈\n- 一致性设计\n\n---",
      "first_definition": "",
      "id": "02-018"
    },
    {
      "title": "认知训练",
      "section": "八、认知心理学应用",
      "level": 3,
      "raw": "**方法**：\n- 工作记忆训练\n- 注意力训练\n- 问题解决训练\n\n---",
      "first_definition": "",
      "id": "02-019"
    },
    {
      "title": "记忆系统",
      "section": "九、认知心理学速查",
      "level": 3,
      "raw": "| 记忆 | 容量 | 持续时间 | 编码 |\n|------|------|----------|--------|\n| 感觉登记 | 很大 | 毫秒 | 感觉形式 |\n| 工作记忆 | 7±2 | 秒-分 | 语音、视觉 |\n| 长时记忆 | 无限 | 分-终身 | 语义、情节 |",
      "first_definition": "",
      "id": "02-020"
    },
    {
      "title": "问题解决",
      "section": "九、认知心理学速查",
      "level": 3,
      "raw": "| 策略 | 说明 |\n|------|------|\n| 算法 | 系统尝试所有可能 |\n| 启发法 | 经验规则 |\n| 手段-目的分析 | 缩小差距 |\n| 逆向搜索 | 从目标倒推 |",
      "first_definition": "",
      "id": "02-021"
    },
    {
      "title": "决策偏差",
      "section": "九、认知心理学速查",
      "level": 3,
      "raw": "| 偏差 | 说明 |\n|------|------|\n| 过度自信 | 高估自己判断 |\n| 后见之明 | 事后觉得显而易见 |\n| 框架效应 | 表述方式影响决策 |\n| 沉没成本 | 考虑已投入成本 |",
      "first_definition": "",
      "id": "02-022"
    }
  ]
}