{
  "category": "积极心理学",
  "category_id": "07",
  "source_file": "../_PsychologyLib/07_积极心理学/积极心理学.md",
  "concept_count": 22,
  "parsed_at": "2026-08-24T03:31:51+08:00",
  "schema_version": "0.1.0",
  "concepts": [
    {
      "title": "什么是积极心理学",
      "section": "一、积极心理学基本概念",
      "level": 3,
      "raw": "**定义**：研究积极情绪、积极特质、积极制度的心理学分支\n\n**研究目标**：\n\n| 目标 | 说明 |\n|------|------|\n| 促进幸福感 | 提高生活满意度 |\n| 挖掘优势 | 发挥个人优势 |\n| 预防问题 | 预防心理疾病 |\n| 促进繁荣 | 个人和社会繁荣 |\n\n---",
      "first_definition": "研究积极情绪、积极特质、积极制度的心理学分支",
      "id": "07-001"
    },
    {
      "title": "积极心理学研究内容",
      "section": "一、积极心理学基本概念",
      "level": 3,
      "raw": "**三大支柱**（塞利格曼）：\n\n| 支柱 | 说明 |\n|------|------|\n| 积极情绪 | 快乐、满足、希望 |\n| 积极特质 | 优势、美德、才能 |\n| 积极制度 | 家庭、学校、社区、职场 |\n\n---",
      "first_definition": "",
      "id": "07-002"
    },
    {
      "title": "幸福感类型",
      "section": "二、幸福感理论",
      "level": 3,
      "raw": "| 类型 | 说明 | 代表 |\n|------|------|-------|\n| 享乐幸福感 | 快乐、满意 | 快乐论 |\n| 实现幸福感 | 意义、成长 | 实现论 |\n\n---",
      "first_definition": "",
      "id": "07-003"
    },
    {
      "title": "幸福感理论",
      "section": "二、幸福感理论",
      "level": 3,
      "raw": "**需求满足理论**（Ryan & Deci）：\n- 自主需求\n- 胜任需求\n- 关系需求\n\n**PERMA模型**（塞利格曼）：\n\n| 成分 | 说明 |\n|------|------|\n| P - 积极情绪（Positive Emotion） | 快乐、乐观 |\n| E - 投入（Engagement） | 心流体验 |\n| R - 关系（Relationships） | 积极人际关系 |\n| M - 意义（Meaning） | 服务于更大目标 |\n| A - 成就（Accomplishment） | 追求目标、成就感 |\n\n---",
      "first_definition": "",
      "id": "07-004"
    },
    {
      "title": "影响幸福感因素",
      "section": "二、幸福感理论",
      "level": 3,
      "raw": "**研究发现**（吕博米尔斯基）：\n- 遗传设定点（50%）\n- 生活情境（10%）\n- 意向活动（40%）\n\n**可改变因素**：\n- 感恩练习\n- 乐观思维\n- 社会连接\n- 身体健康\n- 投入活动\n\n---",
      "first_definition": "",
      "id": "07-005"
    },
    {
      "title": "积极情绪功能（弗雷德里克森）",
      "section": "三、积极情绪",
      "level": 3,
      "raw": "**拓宽建构理论**：\n- 拓宽注意和思维\n- 建构个人资源\n- 抵消消极情绪\n- 促进心理韧性\n\n**积极情绪类型**：\n- 快乐\n- 感激\n- 宁静\n- 兴趣\n- 希望\n- 自豪\n- 逗趣\n- 敬畏\n\n---",
      "first_definition": "",
      "id": "07-006"
    },
    {
      "title": "培养积极情绪",
      "section": "三、积极情绪",
      "level": 3,
      "raw": "**方法**：\n\n| 方法 | 说明 |\n|------|------|\n| 感恩日记 | 记录值得感恩的事 |\n| 正念冥想 | 活在当下 |\n| 善举 | 做善事 |\n| 乐观思维 | 积极解释风格 |\n| 社会连接 | 与积极的人相处 |\n\n---",
      "first_definition": "",
      "id": "07-007"
    },
    {
      "title": "性格优势分类（VIA）",
      "section": "四、性格优势与美德",
      "level": 3,
      "raw": "**六大美德**：\n\n| 美德 | 优势 |\n|------|------|\n| 智慧与知识 | 创造力、好奇心、开放思维、热爱学习、洞察力 |\n| 勇气 | 勇敢、毅力、诚实、热情 |\n| 人道主义 | 爱、仁慈、社会智慧 |\n| 正义 | 公民精神、公平、领导力 |\n| 节制 | 宽恕、谦逊、审慎、自我调节 |\n| 超越 | 审美、感恩、希望、幽默、灵性 |\n\n---",
      "first_definition": "",
      "id": "07-008"
    },
    {
      "title": "优势识别与应用",
      "section": "四、性格优势与美德",
      "level": 3,
      "raw": "**原则**：\n- 识别签名优势\n- 在多种情境使用优势\n- 用新方式使用优势\n- 将优势与情境匹配\n\n**应用**：\n- 职业选择\n- 教育干预\n- 心理治疗\n- 团队建设\n\n---",
      "first_definition": "",
      "id": "07-009"
    },
    {
      "title": "什么是心流",
      "section": "五、心流",
      "level": 3,
      "raw": "**定义**：完全投入活动的心理状态\n\n**特征**：\n\n| 特征 | 说明 |\n|------|------|\n| 挑战与技能平衡 | 任务难度适中 |\n| 行动与意识融合 | 全神贯注 |\n| 清晰目标 | 目标明确 |\n| 即时反馈 | 知道做得如何 |\n| 专注当下 | 注意力集中 |\n| 控制感 | 感到能控制 |\n| 自我消失 | 忘记自我 |\n| 时间感扭曲 | 时间过得快或慢 |\n\n---",
      "first_definition": "完全投入活动的心理状态",
      "id": "07-010"
    },
    {
      "title": "促进心流条件",
      "section": "五、心流",
      "level": 3,
      "raw": "**条件**：\n- 明确目标\n- 即时反馈\n- 挑战与技能平衡\n- 专注环境\n\n**应用**：\n- 工作设计\n- 教育设计\n- 游戏设计\n- 运动训练\n\n---",
      "first_definition": "",
      "id": "07-011"
    },
    {
      "title": "乐观",
      "section": "六、乐观与希望",
      "level": 3,
      "raw": "**解释风格理论**（塞利格曼）：\n\n| 类型 | 积极事件 | 消极事件 |\n|------|----------|----------|\n| 乐观 | 永久、普遍、内部 | 暂时、特定、外部 |\n| 悲观 | 暂时、特定、外部 | 永久、普遍、内部 |\n\n**培养乐观**：\n- 识别消极解释\n- 辩论消极想法\n- 发展积极解释\n\n---",
      "first_definition": "",
      "id": "07-012"
    },
    {
      "title": "希望",
      "section": "六、乐观与希望",
      "level": 3,
      "raw": "**希望理论**（斯奈德）：\n- 目标思想（目标）\n- 路径思想（方法）\n- 动力思想（动力）\n\n**培养希望**：\n- 设定目标\n- 找到路径\n- 增强动力\n\n---",
      "first_definition": "",
      "id": "07-013"
    },
    {
      "title": "什么是韧性",
      "section": "七、韧性",
      "level": 3,
      "raw": "**定义**：面对逆境恢复和成长的能力\n\n**韧性因素**：\n\n| 因素 | 说明 |\n|------|------|\n| 个人因素 | 乐观、自我效能、问题解决 |\n| 家庭因素 | 支持、稳定、沟通 |\n| 社会因素 | 朋友、社区、学校 |\n\n---",
      "first_definition": "面对逆境恢复和成长的能力",
      "id": "07-014"
    },
    {
      "title": "培养韧性",
      "section": "七、韧性",
      "level": 3,
      "raw": "**方法**：\n\n| 方法 | 说明 |\n|------|------|\n| 建立连接 | 发展支持关系 |\n| 避免 victim mindset | 不把自己当受害者 |\n| 接受变化 | 接受不能改变的事 |\n| 设定目标 | 采取小步骤 |\n| 采取行动 | 积极行动 |\n| 培养自我发现 | 从逆境中学习 |\n| 培养接纳自我 | 接受自己不完美 |\n| 保持前景 | 长远眼光 |\n\n---",
      "first_definition": "",
      "id": "07-015"
    },
    {
      "title": "教育应用",
      "section": "八、积极心理学应用",
      "level": 3,
      "raw": "**积极教育**：\n- 培养品格优势\n- 促进 engagement\n- 建立积极关系\n- 培养意义感\n- 促进成就感\n\n---",
      "first_definition": "",
      "id": "07-016"
    },
    {
      "title": "组织应用",
      "section": "八、积极心理学应用",
      "level": 3,
      "raw": "**积极组织**：\n- 优势导向管理\n- 促进员工投入\n- 建立积极关系\n- 意义工作\n- 认可成就\n\n---",
      "first_definition": "",
      "id": "07-017"
    },
    {
      "title": "心理治疗应用",
      "section": "八、积极心理学应用",
      "level": 3,
      "raw": "**积极心理治疗**：\n- 关注优势和潜能\n- 培养积极情绪\n- 建立希望\n- 促进意义\n\n---",
      "first_definition": "",
      "id": "07-018"
    },
    {
      "title": "社区应用",
      "section": "八、积极心理学应用",
      "level": 3,
      "raw": "**积极社区**：\n- 建立社会资本\n- 促进公民参与\n- 培养集体效能\n- 建立积极制度\n\n---",
      "first_definition": "",
      "id": "07-019"
    },
    {
      "title": "PERMA模型",
      "section": "九、积极心理学速查",
      "level": 3,
      "raw": "| 成分 | 说明 |\n|------|------|\n| P - 积极情绪 | 快乐、乐观 |\n| E - 投入 | 心流体验 |\n| R - 关系 | 积极人际关系 |\n| M - 意义 | 服务于更大目标 |\n| A - 成就 | 追求目标、成就感 |",
      "first_definition": "",
      "id": "07-020"
    },
    {
      "title": "性格优势",
      "section": "九、积极心理学速查",
      "level": 3,
      "raw": "| 美德 | 优势 |\n|------|------|\n| 智慧与知识 | 创造力、好奇心、热爱学习 |\n| 勇气 | 勇敢、毅力、诚实 |\n| 人道主义 | 爱、仁慈、社会智慧 |\n| 正义 | 公民精神、公平、领导力 |\n| 节制 | 宽恕、谦逊、自我调节 |\n| 超越 | 审美、感恩、希望、幽默 |",
      "first_definition": "",
      "id": "07-021"
    },
    {
      "title": "培养幸福感",
      "section": "九、积极心理学速查",
      "level": 3,
      "raw": "| 方法 | 说明 |\n|------|------|\n| 感恩日记 | 记录值得感恩的事 |\n| 善举 | 做善事 |\n| 心流 | 投入活动 |\n| 优势使用 | 用优势做事 |\n| 社会连接 | 与积极的人相处 |",
      "first_definition": "",
      "id": "07-022"
    }
  ]
}