{
  "category": "心理治疗方法",
  "category_id": "08",
  "source_file": "../_PsychologyLib/08_心理治疗方法/心理治疗方法.md",
  "concept_count": 21,
  "parsed_at": "2026-08-24T03:31:51+08:00",
  "schema_version": "0.1.0",
  "concepts": [
    {
      "title": "什么是心理治疗",
      "section": "一、心理治疗方法基本概念",
      "level": 3,
      "raw": "**定义**：基于心理学理论，由专业人员帮助来访者改变思维、情感、行为的系统方法\n\n**治疗要素**：\n\n| 要素 | 说明 |\n|------|------|\n| 治疗关系 | 治疗联盟 |\n| 治疗理论 | 指导治疗的理论 |\n| 治疗技术 | 具体干预方法 |\n| 治疗设置 | 时间、地点、费用 |\n\n---",
      "first_definition": "基于心理学理论，由专业人员帮助来访者改变思维、情感、行为的系统方法",
      "id": "08-001"
    },
    {
      "title": "心理治疗共同因素",
      "section": "一、心理治疗方法基本概念",
      "level": 3,
      "raw": "**研究发现**（ Duncan, Miller）：\n- 治疗关系（30%）\n- 期望和希望（15%）\n- 治疗模型（15%）\n- 来访者因素（40%）\n- 其他因素（ undocumented）\n\n---",
      "first_definition": "",
      "id": "08-002"
    },
    {
      "title": "经典精神分析",
      "section": "二、精神动力学治疗",
      "level": 3,
      "raw": "**技术**：\n\n| 技术 | 说明 |\n|------|------|\n| 自由联想 | 自由说出想法 |\n|  dream分析 | 分析梦境 |\n| 阻抗分析 | 分析抵抗 |\n| 移情分析 | 分析移情 |\n\n**治疗目标**：\n- 意识化无意识冲突\n- 重构人格\n\n---",
      "first_definition": "",
      "id": "08-003"
    },
    {
      "title": "短程精神动力学治疗",
      "section": "二、精神动力学治疗",
      "level": 3,
      "raw": "**特点**：\n- 聚焦核心冲突\n- 时间有限\n- 目标明确\n\n---",
      "first_definition": "",
      "id": "08-004"
    },
    {
      "title": "CBT基本理论",
      "section": "三、认知行为疗法（CBT）",
      "level": 3,
      "raw": "**核心观点**：\n- 思维影响情绪和行为\n- 改变认知可以改变情绪行为\n- 结构化、短程、目标导向\n\n**治疗过程**：\n1. 评估问题\n2. 设定目标\n3. 识别消极思维\n4. 挑战消极思维\n5. 行为改变\n6. 预防复发\n\n---",
      "first_definition": "",
      "id": "08-005"
    },
    {
      "title": "CBT技术",
      "section": "三、认知行为疗法（CBT）",
      "level": 3,
      "raw": "**认知技术**：\n\n| 技术 | 说明 |\n|------|------|\n| 思维记录 | 记录思维、情绪、行为 |\n| 苏格拉底提问 | 质疑消极思维 |\n| 证据检验 | 寻找支持/反对证据 |\n| 重新归因 | 重新归因 |\n| 去中心化 | 减少自我关注 |\n\n**行为技术**：\n\n| 技术 | 说明 |\n|------|------|\n| 行为激活 | 增加愉快活动 |\n| 暴露疗法 | 面对恐惧 |\n| 行为实验 | 测试信念 |\n| 问题解决 | 系统解决问题 |\n| 放松训练 | 减少焦虑 |\n\n---",
      "first_definition": "",
      "id": "08-006"
    },
    {
      "title": "CBT应用",
      "section": "三、认知行为疗法（CBT）",
      "level": 3,
      "raw": "**适用障碍**：\n- 抑郁症\n- 焦虑障碍\n- 强迫症\n- 创伤后应激障碍\n- 进食障碍\n- 物质使用障碍\n\n---",
      "first_definition": "",
      "id": "08-007"
    },
    {
      "title": "以人为中心治疗（罗杰斯）",
      "section": "四、人本主义治疗",
      "level": 3,
      "raw": "**核心条件**：\n\n| 条件 | 说明 |\n|------|------|\n| 共情理解 | 理解来访者世界 |\n| 无条件积极关注 | 不评判地接纳 |\n| 真诚一致 | 治疗师真实 |\n\n**治疗目标**：\n- 自我概念与现实经验一致\n- 成为功能完善的人\n\n---",
      "first_definition": "",
      "id": "08-008"
    },
    {
      "title": "格式塔治疗（皮尔斯）",
      "section": "四、人本主义治疗",
      "level": 3,
      "raw": "**核心观点**：\n- 关注此时此地\n- 整合分裂的部分\n- 增强觉察\n\n**技术**：\n- 空椅技术\n- 角色扮演\n- 身体觉察\n\n---",
      "first_definition": "",
      "id": "08-009"
    },
    {
      "title": "存在主义治疗",
      "section": "四、人本主义治疗",
      "level": 3,
      "raw": "**核心议题**：\n\n| 议题 | 说明 |\n|------|------|\n| 死亡 | 面对死亡 |\n| 自由 | 承担责任 |\n| 孤独 | 根本孤独 |\n| 无意义 | 创造意义 |\n\n---",
      "first_definition": "",
      "id": "08-010"
    },
    {
      "title": "系统理论",
      "section": "五、家庭治疗",
      "level": 3,
      "raw": "**核心观点**：\n- 问题不是个人的，而是系统的\n- 改变系统可以改变个体\n- 症状有系统功能\n\n---",
      "first_definition": "",
      "id": "08-011"
    },
    {
      "title": "家庭治疗流派",
      "section": "五、家庭治疗",
      "level": 3,
      "raw": "| 流派 | 代表 | 核心观点 |\n|------|------|----------|\n| 结构家庭治疗 | Minuchin | 改变家庭结构 |\n| 策略家庭治疗 | Haley | 直接干预症状 |\n| 系统家庭治疗 | Selvini | 挑战家庭信念 |\n| 叙事家庭治疗 | White | 外化问题、重写故事 |\n\n---",
      "first_definition": "",
      "id": "08-012"
    },
    {
      "title": "团体治疗特点",
      "section": "六、团体治疗",
      "level": 3,
      "raw": "**优势**：\n- 成本效益\n- 普遍性（不是唯一的）\n- 传递希望\n- 社会学习\n- 演练新行为\n\n**类型**：\n- 支持性团体\n- 过程导向团体\n- 心理教育团体\n- 技能训练团体\n\n---",
      "first_definition": "",
      "id": "08-013"
    },
    {
      "title": "整合类型",
      "section": "七、整合性心理治疗",
      "level": 3,
      "raw": "| 类型 | 说明 |\n|------|------|\n| 理论整合 | 结合不同理论 |\n| 技术整合 | 结合不同技术 |\n| 共同因素整合 | 关注共同因素 |\n| 同化整合 | 以一理论为主，吸收其他 |\n\n---",
      "first_definition": "",
      "id": "08-014"
    },
    {
      "title": "正念疗法",
      "section": "八、新兴治疗方法",
      "level": 3,
      "raw": "**类型**：\n\n| 类型 | 说明 |\n|------|------|\n| MBSR | 正念减压 |\n| MBCT | 正念认知治疗 |\n| ACT | 接受与承诺治疗 |\n\n**核心技术**：\n- 正念冥想\n- 身体扫描\n- 正念瑜伽\n\n---",
      "first_definition": "",
      "id": "08-015"
    },
    {
      "title": "网络治疗",
      "section": "八、新兴治疗方法",
      "level": 3,
      "raw": "**类型**：\n- 自助程序\n- 治疗师引导在线治疗\n- 虚拟现实治疗\n\n**优势**：\n- 可及性高\n- 减少污名\n- 成本较低\n\n---",
      "first_definition": "",
      "id": "08-016"
    },
    {
      "title": "治疗选择原则",
      "section": "九、心理治疗选择",
      "level": 3,
      "raw": "| 原则 | 说明 |\n|------|------|\n| 实证支持 | 选择有证据支持的治疗 |\n| 患者偏好 | 考虑患者偏好 |\n| 文化背景 | 考虑文化背景 |\n| 治疗师能力 | 治疗师受训背景 |\n| 障碍类型 | 不同障碍适合不同治疗 |\n\n---",
      "first_definition": "",
      "id": "08-017"
    },
    {
      "title": "不同障碍推荐治疗",
      "section": "九、心理治疗选择",
      "level": 3,
      "raw": "| 障碍 | 推荐治疗 |\n|------|----------|\n| 抑郁症 | CBT、IPT、药物治疗 |\n| 焦虑障碍 | CBT、暴露疗法 |\n| 强迫症 | CBT（暴露反应阻止） |\n| PTSD | CBT、EMDR |\n| 进食障碍 | CBT、家庭治疗 |\n| 人格障碍 | DBT、图式治疗 |\n| 夫妻关系 | 情感聚焦治疗、行为夫妻治疗 |\n\n---",
      "first_definition": "",
      "id": "08-018"
    },
    {
      "title": "主要治疗流派",
      "section": "十、心理治疗方法速查",
      "level": 3,
      "raw": "| 流派 | 代表 | 核心技术 |\n|------|------|----------|\n| 精神动力学 | 弗洛伊德 | 自由联想、移情分析 |\n| 认知行为 | Beck、Ellis | 认知重构、行为实验 |\n| 人本主义 | 罗杰斯 | 共情、无条件积极关注 |\n| 家庭治疗 | Minuchin、Haley | 改变结构、挑战信念 |\n| 团体治疗 | Yalom | 团体动力、人际学习 |",
      "first_definition": "",
      "id": "08-019"
    },
    {
      "title": "治疗选择",
      "section": "十、心理治疗方法速查",
      "level": 3,
      "raw": "| 障碍 | 推荐治疗 |\n|------|----------|\n| 抑郁 | CBT、IPT |\n| 焦虑 | CBT、暴露 |\n| 强迫 | CBT（ERP） |\n| PTSD | CBT、EMDR |\n| 进食障碍 | CBT、家庭治疗 |",
      "first_definition": "",
      "id": "08-020"
    },
    {
      "title": "新兴治疗",
      "section": "十、心理治疗方法速查",
      "level": 3,
      "raw": "| 方法 | 说明 |\n|------|------|\n| 正念疗法 | 正念减压、MBCT、ACT |\n| 网络治疗 | 在线治疗、虚拟现实 |\n| 整合治疗 | 理论整合、技术整合 |",
      "first_definition": "",
      "id": "08-021"
    }
  ]
}