{
  "category": "社会心理学",
  "category_id": "04",
  "source_file": "../_PsychologyLib/04_社会心理学/社会心理学.md",
  "concept_count": 19,
  "parsed_at": "2026-08-24T03:31:51+08:00",
  "schema_version": "0.1.0",
  "concepts": [
    {
      "title": "什么是社会心理学",
      "section": "一、社会心理学基本概念",
      "level": 3,
      "raw": "**定义**：研究社会情境下人的思想、情感、行为\n\n**研究内容**：\n\n| 内容 | 说明 |\n|------|------|\n| 社会认知 | 如何感知和理解社会 |\n| 社会影响 | 他人如何影响个体 |\n| 社会关系 | 人际吸引、偏见、冲突 |\n\n---",
      "first_definition": "研究社会情境下人的思想、情感、行为",
      "id": "04-001"
    },
    {
      "title": "社会心理学研究方法",
      "section": "一、社会心理学基本概念",
      "level": 3,
      "raw": "| 方法 | 说明 | 例子 |\n|------|------|-------|\n| 实验法 | 控制变量 | 斯坦福监狱实验 |\n| 调查法 | 问卷调查 | 态度调查 |\n| 观察法 | 自然观察 | 助人为乐行为观察 |\n| 元分析 | 综合分析 | 整合多项研究结果 |\n\n---",
      "first_definition": "",
      "id": "04-002"
    },
    {
      "title": "社会知觉",
      "section": "二、社会认知",
      "level": 3,
      "raw": "**首因效应**：第一印象影响后续判断\n\n**近因效应**：最近信息影响判断\n\n**晕轮效应**：一个特质影响整体评价\n\n**刻板印象**：对某群体成员的固定看法\n\n---",
      "first_definition": "",
      "id": "04-003"
    },
    {
      "title": "归因理论",
      "section": "二、社会认知",
      "level": 3,
      "raw": "**海德**：内部归因 vs 外部归因\n\n**韦纳**：内部/外部 × 稳定/不稳定 × 可控/不可控\n\n**凯利**：共识性、一致性、区别性\n\n**基本归因错误**：\n- 过度强调内部归因\n- 忽视情境因素\n\n---",
      "first_definition": "",
      "id": "04-004"
    },
    {
      "title": "自我概念",
      "section": "二、社会认知",
      "level": 3,
      "raw": "**自我图式**：关于自己的认知结构\n\n**自我知觉理论**（贝姆）：\n- 通过观察自己行为推断态度\n\n**自我呈现**：管理他人对自己印象\n\n**自我服务偏差**：\n- 成功归因于自己\n- 失败归因于情境\n\n---",
      "first_definition": "",
      "id": "04-005"
    },
    {
      "title": "从众",
      "section": "三、社会影响",
      "level": 3,
      "raw": "**阿希实验**：\n- 群体压力导致从众\n- 即使明显错误也跟随\n\n**从众原因**：\n- 信息性影响（他人可能正确）\n- 规范性影响（被群体接纳）\n\n---",
      "first_definition": "",
      "id": "04-006"
    },
    {
      "title": "服从",
      "section": "三、社会影响",
      "level": 3,
      "raw": "**米尔格拉姆实验**：\n- 65%受试者服从到最高电压\n- 权威力量强大\n\n**服从条件**：\n- 权威接近性\n- 受害者距离\n- 权威机构性质\n\n---",
      "first_definition": "",
      "id": "04-007"
    },
    {
      "title": "依从",
      "section": "三、社会影响",
      "level": 3,
      "raw": "**技巧**：\n\n| 技巧 | 说明 |\n|------|------|\n| 登门槛 | 先小请求，再大请求 |\n| 留面子 | 先大请求被拒，再小请求 |\n| 低球法 | 先承诺，再增加条件 |\n| 稀缺性 | 强调稀缺，促进行动 |\n\n---",
      "first_definition": "",
      "id": "04-008"
    },
    {
      "title": "群体影响",
      "section": "三、社会影响",
      "level": 3,
      "raw": "**社会促进**：他人在场促进简单任务表现\n\n**社会懈怠**：群体努力小于个人努力之和\n\n**去个性化**：群体中丧失自我意识\n\n**群体极化**：群体决策比个体更极端\n\n**群体思维**：追求一致，忽视替代方案\n\n---",
      "first_definition": "",
      "id": "04-009"
    },
    {
      "title": "人际吸引",
      "section": "四、社会关系",
      "level": 3,
      "raw": "**影响因素**：\n\n| 因素 | 说明 |\n|------|------|\n| 接近性 | 物理距离近易吸引 |\n| 相似性 | 态度价值观相似 |\n| 互补性 | 需求互补 |\n| 外表吸引力 | 外表影响第一印象 |\n| 熟悉性 | 曝光效应 |\n\n**爱情理论**（斯腾伯格）：\n\n| 成分 | 说明 |\n|------|------|\n| 亲密 | 情感联结 |\n| 激情 | 浪漫吸引 |\n| 承诺 | 维持关系决定 |\n\n- 喜欢：亲密\n- 迷恋：激情\n- 空爱：承诺\n- 浪漫爱：亲密+激情\n- 伴侣爱：亲密+承诺\n- 愚昧爱：激情+承诺\n- 完满爱：亲密+激情+承诺\n\n---",
      "first_definition": "",
      "id": "04-010"
    },
    {
      "title": "偏见与歧视",
      "section": "四、社会关系",
      "level": 3,
      "raw": "**偏见**：对某群体负面态度\n\n**歧视**：对某群体不公平行为\n\n**偏见根源**：\n\n| 根源 | 说明 |\n|------|------|\n| 社会分类 | 内群体偏袒 |\n| 现实冲突 | 资源竞争 |\n| 社会学习 | 模仿他人偏见 |\n| 认知简化 | 刻板印象 |\n\n**减少偏见**：\n- 接触假说（平等地位、共同目标）\n- 合作学习\n- 个体差异强调\n\n---",
      "first_definition": "",
      "id": "04-011"
    },
    {
      "title": "攻击行为",
      "section": "四、社会关系",
      "level": 3,
      "raw": "**理论**：\n\n| 理论 | 核心观点 |\n|------|----------|\n| 本能论 | 攻击是本能 |\n| 挫折-攻击理论 | 挫折导致攻击 |\n| 社会学习理论 | 攻击是学习得来 |\n\n**减少攻击**：\n- 减少挫折\n- 示范非攻击行为\n- 惩罚攻击行为\n- 提供宣泄渠道\n\n---",
      "first_definition": "",
      "id": "04-012"
    },
    {
      "title": "助人行为",
      "section": "四、社会关系",
      "level": 3,
      "raw": "**助人决策过程**：\n1. 注意事件\n2. 解释为紧急情况\n3. 承担责任\n4. 知道如何帮助\n5. 决定帮助\n\n**影响因素**：\n\n| 因素 | 说明 |\n|------|------|\n| 旁观者效应 | 人越多，帮助越少 |\n| 相似性 | 相似的人更易帮助 |\n| 心情 | 好心情更易帮助 |\n|  guilt | 内疚感促进帮助 |\n\n---",
      "first_definition": "",
      "id": "04-013"
    },
    {
      "title": "态度成分",
      "section": "五、态度与态度改变",
      "level": 3,
      "raw": "| 成分 | 说明 |\n|------|------|\n| 认知 | 信念 |\n| 情感 | 感受 |\n| 行为 | 行动倾向 |\n\n---",
      "first_definition": "",
      "id": "04-014"
    },
    {
      "title": "态度改变理论",
      "section": "五、态度与态度改变",
      "level": 3,
      "raw": "**精细加工可能性模型**（PETTY & CACIOPPO）：\n\n| 路径 | 说明 |\n|------|------|\n| 中心路径 | 仔细思考论点 |\n| 外围路径 | 依靠线索（颜值、权威） |\n\n**认知失调理论**（费斯廷格）：\n- 态度与行为矛盾产生不适\n- 改变态度或行为减少失调\n\n---",
      "first_definition": "",
      "id": "04-015"
    },
    {
      "title": "应用领域",
      "section": "六、社会心理学应用",
      "level": 3,
      "raw": "| 领域 | 应用 |\n|------|------|\n| 消费心理学 | 广告、营销 |\n| 组织心理学 | 领导力、团队 |\n| 健康心理学 | 健康行为改变 |\n| 环境心理学 | 亲环境行为 |\n| 法律心理学 | 陪审团决策 |\n\n---",
      "first_definition": "",
      "id": "04-016"
    },
    {
      "title": "社会影响",
      "section": "七、社会心理学速查",
      "level": 3,
      "raw": "| 现象 | 说明 |\n|------|------|\n| 从众 | 跟随群体 |\n| 服从 | 服从权威 |\n| 依从 | 应允请求 |\n| 群体思维 | 追求一致损害决策 |",
      "first_definition": "",
      "id": "04-017"
    },
    {
      "title": "社会关系",
      "section": "七、社会心理学速查",
      "level": 3,
      "raw": "| 现象 | 说明 |\n|------|------|\n| 人际吸引 | 接近、相似、互补 |\n| 偏见 | 对某群体负面态度 |\n| 攻击 | 意图伤害他人行为 |\n| 助人 | 利他行为 |",
      "first_definition": "",
      "id": "04-018"
    },
    {
      "title": "态度改变",
      "section": "七、社会心理学速查",
      "level": 3,
      "raw": "| 理论 | 核心观点 |\n|------|----------|\n| 精细加工模型 | 中心路径 vs 外围路径 |\n| 认知失调 | 态度行为矛盾产生不适 |",
      "first_definition": "",
      "id": "04-019"
    }
  ]
}