{
  "category": "心理学大师",
  "category_id": "10",
  "source_file": "../_PsychologyLib/10_心理学大师/心理学大师.md",
  "concept_count": 32,
  "parsed_at": "2026-08-24T03:32:18+08:00",
  "schema_version": "0.1.0",
  "concepts": [
    {
      "title": "冯特（Wilhelm Wundt, 1832-1920）",
      "section": "一、心理学先驱",
      "level": 3,
      "raw": "**贡献**：\n\n| 贡献 | 说明 |\n|------|------|\n| 建立第一个心理学实验室 | 1879年，莱比锡大学 |\n| 构造主义 | 研究意识结构 |\n| 内省法 | 系统内省 |\n| 实验心理学 | 心理学成为独立学科 |\n\n**主要著作**：\n- 《生理心理学原理》\n- 《民族心理学》\n\n**历史地位**：\n- 心理学之父\n- 实验心理学创始人\n\n---",
      "first_definition": "",
      "id": "10-001"
    },
    {
      "title": "詹姆斯（William James, 1842-1910）",
      "section": "一、心理学先驱",
      "level": 3,
      "raw": "**贡献**：\n\n| 贡献 | 说明 |\n|------|------|\n| 机能主义 | 关注心理功能 |\n| 《心理学原理》 | 经典教科书 |\n| 情绪理论 | 詹姆斯-兰格理论 |\n| 实用主义 | 心理学应用 |\n\n**主要著作**：\n- 《心理学原理》\n- 《宗教经验种种》\n\n**历史地位**：\n- 美国心理学之父\n- 推动应用心理学\n\n---",
      "first_definition": "",
      "id": "10-002"
    },
    {
      "title": "铁钦纳（Edward Titchener, 1867-1927）",
      "section": "一、心理学先驱",
      "level": 3,
      "raw": "**贡献**：\n- 将构造主义系统化\n- 内省法严格训练\n- 培养大批学生\n\n**批评**：\n- 内省法主观\n- 研究内容脱离实际\n\n---",
      "first_definition": "",
      "id": "10-003"
    },
    {
      "title": "华生（John B. Watson, 1878-1958）",
      "section": "二、行为主义大师",
      "level": 3,
      "raw": "**贡献**：\n\n| 贡献 | 说明 |\n|------|------|\n| 行为主义宣言 | 《行为主义者心目中的心理学》 |\n| 小阿尔伯特实验 | 情绪条件反射 |\n| 环境决定论 | 否认遗传作用 |\n| 预测控制 | 心理学目标是预测控制行为 |\n\n**主要著作**：\n- 《行为主义》\n\n**历史地位**：\n- 行为主义创始人\n- 推动心理学客观化\n\n---",
      "first_definition": "",
      "id": "10-004"
    },
    {
      "title": "斯金纳（B.F. Skinner, 1904-1990）",
      "section": "二、行为主义大师",
      "level": 3,
      "raw": "**贡献**：\n\n| 贡献 | 说明 |\n|------|------|\n| 操作条件反射 | 强化理论 |\n| 程序教学 | 教学机器 |\n| 行为工程 | 行为技术应用 |\n| 言语行为 | 语言的行为分析 |\n\n**主要著作**：\n- 《科学与人类行为》\n- 《言语行为》\n- 《超越自由与尊严》\n\n**历史地位**：\n- 行为主义集大成者\n- 推动应用行为分析\n\n---",
      "first_definition": "",
      "id": "10-005"
    },
    {
      "title": "韦特海默（Max Wertheimer, 1880-1943）",
      "section": "三、格式塔心理学大师",
      "level": 3,
      "raw": "**贡献**：\n- 格式塔心理学创始人\n- 似动现象研究\n- 创造性思维研究\n\n---",
      "first_definition": "",
      "id": "10-006"
    },
    {
      "title": "苛勒（Wolfgang Köhler, 1887-1967）",
      "section": "三、格式塔心理学大师",
      "level": 3,
      "raw": "**贡献**：\n\n| 贡献 | 说明 |\n|------|------|\n| 顿悟学习 | 黑猩猩实验 |\n| 场论 | 心理场概念 |\n| 物理创伤理论 | 脑损伤研究 |\n\n**主要著作**：\n- 《人猿的智慧》\n\n---",
      "first_definition": "",
      "id": "10-007"
    },
    {
      "title": "考夫卡（Kurt Koffka, 1886-1941）",
      "section": "三、格式塔心理学大师",
      "level": 3,
      "raw": "**贡献**：\n- 格式塔心理学传播者\n- 《格式塔心理学原理》\n\n---",
      "first_definition": "",
      "id": "10-008"
    },
    {
      "title": "弗洛伊德（Sigmund Freud, 1856-1939）",
      "section": "四、精神分析大师",
      "level": 3,
      "raw": "**贡献**：\n\n| 贡献 | 说明 |\n|------|------|\n| 精神分析 | 潜意识理论 |\n| 人格结构 | 本我、自我、超我 |\n| 心理性发展 | 五阶段 |\n| 梦的解析 | 梦是愿望满足 |\n| 心理治疗 | 自由联想、梦的分析 |\n\n**主要著作**：\n- 《梦的解析》\n- 《日常生活心理病理学》\n- 《文明及其不满》\n\n**历史地位**：\n- 精神分析创始人\n- 深刻影响心理学与文化\n\n---",
      "first_definition": "",
      "id": "10-009"
    },
    {
      "title": "荣格（Carl Jung, 1875-1961）",
      "section": "四、精神分析大师",
      "level": 3,
      "raw": "**贡献**：\n\n| 贡献 | 说明 |\n|------|------|\n| 分析心理学 | 集体无意识 |\n| 原型理论 | 原型、阴影、阿尼玛 |\n| 心理类型 | 内倾/外倾、四功能 |\n| 个性化 | 自性实现 |\n\n**主要著作**：\n- 《分析心理学的理论与实践》\n- 《原型与集体无意识》\n\n---",
      "first_definition": "",
      "id": "10-010"
    },
    {
      "title": "阿德勒（Alfred Adler, 1870-1937）",
      "section": "四、精神分析大师",
      "level": 3,
      "raw": "**贡献**：\n- 个体心理学\n- 自卑与补偿\n- 生活风格\n- 社会兴趣\n\n---",
      "first_definition": "",
      "id": "10-011"
    },
    {
      "title": "马斯洛（Abraham Maslow, 1908-1970）",
      "section": "五、人本主义大师",
      "level": 3,
      "raw": "**贡献**：\n\n| 贡献 | 说明 |\n|------|------|\n| 需要层次理论 | 五层次需要 |\n| 自我实现 | 人类最高动机 |\n| 积极心理学先驱 | 研究健康人格 |\n| 方法论批评 | 批评行为主义、精神分析 |\n\n**主要著作**：\n- 《动机与人格》\n- 《存在心理学探索》\n\n**历史地位**：\n- 人本主义心理学创始人\n- 积极心理学先驱\n\n---",
      "first_definition": "",
      "id": "10-012"
    },
    {
      "title": "罗杰斯（Carl Rogers, 1902-1987）",
      "section": "五、人本主义大师",
      "level": 3,
      "raw": "**贡献**：\n\n| 贡献 | 说明 |\n|------|------|\n| 以人为中心治疗 | 非指导心理治疗 |\n| 自我理论 | 自我概念、理想自我 |\n| 无条件积极关注 | 治疗核心条件 |\n| 来访者中心 | 尊重来访者 |\n\n**主要著作**：\n- 《咨询与心理治疗》\n- 《论人的成长》\n\n**历史地位**：\n- 人本主义心理学领袖\n- 心理治疗革新者\n\n---",
      "first_definition": "",
      "id": "10-013"
    },
    {
      "title": "奈瑟（Ulric Neisser, 1928-2012）",
      "section": "六、认知心理学大师",
      "level": 3,
      "raw": "**贡献**：\n- 《认知心理学》教科书\n- 认知心理学命名者\n- 生态认知研究\n\n**历史地位**：\n- 认知心理学之父\n\n---",
      "first_definition": "",
      "id": "10-014"
    },
    {
      "title": "西蒙（Herbert Simon, 1916-2001）",
      "section": "六、认知心理学大师",
      "level": 3,
      "raw": "**贡献**：\n\n| 贡献 | 说明 |\n|------|------|\n| 有限理性 | 决策理论研究 |\n| 人工智能 | 认知模拟 |\n| 诺贝尔经济学奖 | 决策理论研究 |\n\n---",
      "first_definition": "",
      "id": "10-015"
    },
    {
      "title": "皮亚杰（Jean Piaget, 1896-1980）",
      "section": "六、认知心理学大师",
      "level": 3,
      "raw": "**贡献**：\n\n| 贡献 | 说明 |\n|------|------|\n| 认知发展四阶段 | 感知运动、前运算、具体运算、形式运算 |\n| 建构主义 | 认知建构过程 |\n| 发生认识论 | 知识起源研究 |\n\n**主要著作**：\n- 《发生认识论》\n\n**历史地位**：\n- 发展心理学巨匠\n- 认知发展理论创始人\n\n---",
      "first_definition": "",
      "id": "10-016"
    },
    {
      "title": "勒温（Kurt Lewin, 1890-1947）",
      "section": "七、社会心理学大师",
      "level": 3,
      "raw": "**贡献**：\n\n| 贡献 | 说明 |\n|------|------|\n| 场论 | 心理场、生活空间 |\n| 团体动力学 | 团体研究 |\n| 行动研究 | 研究-行动结合 |\n| 领导风格 | 专制、民主、放任 |\n\n**历史地位**：\n- 社会心理学先驱\n- 实验社会心理学创始人\n\n---",
      "first_definition": "",
      "id": "10-017"
    },
    {
      "title": "班杜拉（Albert Bandura, 1925-2021）",
      "section": "七、社会心理学大师",
      "level": 3,
      "raw": "**贡献**：\n\n| 贡献 | 说明 |\n|------|------|\n| 社会学习理论 | 观察学习 |\n| 自我效能感 | 自我效能感理论 |\n| 社会认知理论 | 人-环境-行为交互 |\n| 道德推脱 | 道德脱离机制 |\n\n**主要著作**：\n- 《社会学习理论》\n- 《自我效能：控制的实施》\n\n---",
      "first_definition": "",
      "id": "10-018"
    },
    {
      "title": "塞利格曼（Martin Seligman, 1942-）",
      "section": "八、积极心理学大师",
      "level": 3,
      "raw": "**贡献**：\n\n| 贡献 | 说明 |\n|------|------|\n| 积极心理学 | 积极心理学运动领袖 |\n| 习得性无助 | 抑郁理论 |\n| PERMA模型 | 幸福感理论 |\n| 品格优势 | VIA分类 |\n\n**主要著作**：\n- 《真实的幸福》\n- 《持续的幸福》\n\n---",
      "first_definition": "",
      "id": "10-019"
    },
    {
      "title": "席克珍特米哈伊（Mihaly Csikszentmihalyi, 1934-2021）",
      "section": "八、积极心理学大师",
      "level": 3,
      "raw": "**贡献**：\n- 心流理论\n- 《心流：最优体验心理学》\n\n---",
      "first_definition": "",
      "id": "10-020"
    },
    {
      "title": "潘菽（1897-1988）",
      "section": "九、中国心理学大师",
      "level": 3,
      "raw": "**贡献**：\n- 中国现代心理学奠基人\n- 《心理学概论》\n- 推动中国心理学本土化\n\n---",
      "first_definition": "",
      "id": "10-021"
    },
    {
      "title": "高觉敷（1896-1993）",
      "section": "九、中国心理学大师",
      "level": 3,
      "raw": "**贡献**：\n- 中国工业心理学先驱\n- 心理测量中国化\n\n---",
      "first_definition": "",
      "id": "10-022"
    },
    {
      "title": "林崇德（1941-）",
      "section": "九、中国心理学大师",
      "level": 3,
      "raw": "**贡献**：\n- 发展心理学研究\n- 思维发展研究\n- 心理健康教育\n\n---",
      "first_definition": "",
      "id": "10-023"
    },
    {
      "title": "人性观比较",
      "section": "十、心理学大师思想比较",
      "level": 3,
      "raw": "| 大师 | 人性观 |\n|------|--------|\n| 弗洛伊德 | 本能驱动、消极 |\n| 华生 | 环境塑造、白板 |\n| 马斯洛 | 自我实现、积极 |\n| 罗杰斯 | 向上成长、积极 |\n| 皮亚杰 | 主动建构、积极 |\n\n---",
      "first_definition": "",
      "id": "10-024"
    },
    {
      "title": "研究方法比较",
      "section": "十、心理学大师思想比较",
      "level": 3,
      "raw": "| 大师 | 方法 |\n|------|------|\n| 冯特 | 实验内省 |\n| 弗洛伊德 | 个案研究 |\n| 华生 | 实验行为观察 |\n| 皮亚杰 | 临床访谈法 |\n| 班杜拉 | 实验+观察 |\n\n---",
      "first_definition": "",
      "id": "10-025"
    },
    {
      "title": "应用领域比较",
      "section": "十、心理学大师思想比较",
      "level": 3,
      "raw": "| 大师 | 应用领域 |\n|------|----------|\n| 弗洛伊德 | 临床心理治疗 |\n| 斯金纳 | 教育、行为矫正 |\n| 罗杰斯 | 心理咨询、教育 |\n| 班杜拉 | 教育、传媒、临床 |\n| 塞利格曼 | 教育、组织、临床 |\n\n---",
      "first_definition": "",
      "id": "10-026"
    },
    {
      "title": "先驱",
      "section": "十一、心理学大师速查",
      "level": 3,
      "raw": "| 大师 | 贡献 | 代表著作 |\n|------|------|----------|\n| 冯特 | 实验心理学创始人 | 《生理心理学原理》 |\n| 詹姆斯 | 机能主义 | 《心理学原理》 |",
      "first_definition": "",
      "id": "10-027"
    },
    {
      "title": "行为主义",
      "section": "十一、心理学大师速查",
      "level": 3,
      "raw": "| 大师 | 贡献 | 代表著作 |\n|------|------|----------|\n| 华生 | 行为主义创始人 | 《行为主义》 |\n| 斯金纳 | 操作条件反射 | 《科学与人类行为》 |",
      "first_definition": "",
      "id": "10-028"
    },
    {
      "title": "精神分析",
      "section": "十一、心理学大师速查",
      "level": 3,
      "raw": "| 大师 | 贡献 | 代表著作 |\n|------|------|----------|\n| 弗洛伊德 | 精神分析创始人 | 《梦的解析》 |\n| 荣格 | 分析心理学 | 《原型与集体无意识》 |",
      "first_definition": "",
      "id": "10-029"
    },
    {
      "title": "人本主义",
      "section": "十一、心理学大师速查",
      "level": 3,
      "raw": "| 大师 | 贡献 | 代表著作 |\n|------|------|----------|\n| 马斯洛 | 需要层次理论 | 《动机与人格》 |\n| 罗杰斯 | 以人为中心治疗 | 《论人的成长》 |",
      "first_definition": "",
      "id": "10-030"
    },
    {
      "title": "认知心理学",
      "section": "十一、心理学大师速查",
      "level": 3,
      "raw": "| 大师 | 贡献 | 代表著作 |\n|------|------|----------|\n| 奈瑟 | 认知心理学之父 | 《认知心理学》 |\n| 皮亚杰 | 认知发展理论 | 《发生认识论》 |",
      "first_definition": "",
      "id": "10-031"
    },
    {
      "title": "积极心理学",
      "section": "十一、心理学大师速查",
      "level": 3,
      "raw": "| 大师 | 贡献 | 代表著作 |\n|------|------|----------|\n| 塞利格曼 | 积极心理学运动 | 《真实的幸福》 |\n| 席克珍特米哈伊 | 心流理论 | 《心流》 |",
      "first_definition": "",
      "id": "10-032"
    }
  ]
}