{
  "category": "发展心理学",
  "category_id": "03",
  "source_file": "../_PsychologyLib/03_发展心理学/发展心理学.md",
  "concept_count": 24,
  "parsed_at": "2026-08-24T03:31:51+08:00",
  "schema_version": "0.1.0",
  "concepts": [
    {
      "title": "什么是发展心理学",
      "section": "一、发展心理学基本概念",
      "level": 3,
      "raw": "**定义**：研究人类毕生心理发展的学科\n\n**研究领域**：\n\n| 领域 | 说明 |\n|------|------|\n| 生理发展 | 身体、大脑、感官 |\n| 认知发展 | 思维、记忆、智力 |\n| 社会情感发展 | 情绪、人格、社会关系 |\n\n---",
      "first_definition": "研究人类毕生心理发展的学科",
      "id": "03-001"
    },
    {
      "title": "发展心理学基本理论",
      "section": "一、发展心理学基本概念",
      "level": 3,
      "raw": "**争论问题**：\n\n| 问题 | 说明 |\n|------|------|\n| 天性与教养 | 遗传 vs 环境 |\n| 连续性与阶段性 | 渐变 vs 突变 |\n| 稳定性和变化性 | 早期决定 vs 终身可塑 |\n\n---",
      "first_definition": "",
      "id": "03-002"
    },
    {
      "title": "生理发展",
      "section": "二、婴幼儿期发展（0-3岁）",
      "level": 3,
      "raw": "**大脑发展**：\n- 神经元增殖和修剪\n- 突触形成\n- 髓鞘化\n\n**运动发展**：\n- 抬头→翻身→坐→爬→站→走\n- 顺序固定，时间可变\n\n---",
      "first_definition": "",
      "id": "03-003"
    },
    {
      "title": "认知发展（皮亚杰感觉运动阶段）",
      "section": "二、婴幼儿期发展（0-3岁）",
      "level": 3,
      "raw": "**核心成就**：\n- 客体永久性（8-12个月）\n- 因果关系理解\n- 符号思维萌芽\n\n---",
      "first_definition": "",
      "id": "03-004"
    },
    {
      "title": "社会情感发展",
      "section": "二、婴幼儿期发展（0-3岁）",
      "level": 3,
      "raw": "**依恋理论**（鲍尔比）：\n\n| 依恋类型 | 表现 |\n|----------|------|\n| 安全型 | 分离焦虑，但容易安抚 |\n| 回避型 | 分离不焦虑，回避母亲 |\n| 矛盾型 | 分离极度焦虑，难以安抚 |\n| 混乱型 | 行为混乱无序 |\n\n**依恋意义**：\n- 影响未来人际关系\n- 影响情绪调节\n- 影响自我概念\n\n---",
      "first_definition": "",
      "id": "03-005"
    },
    {
      "title": "认知发展（前运算阶段→具体运算阶段）",
      "section": "三、儿童期发展（3-12岁）",
      "level": 3,
      "raw": "**前运算阶段（2-7岁）**：\n- 符号思维\n- 自我中心\n- 缺乏守恒概念\n\n**具体运算阶段（7-11岁）**：\n- 守恒概念\n- 逻辑推理（具体情境）\n- 去自我中心\n\n---",
      "first_definition": "",
      "id": "03-006"
    },
    {
      "title": "社会情感发展",
      "section": "三、儿童期发展（3-12岁）",
      "level": 3,
      "raw": "**自我概念发展**：\n- 从具体到抽象\n- 从单一到多维\n\n**同伴关系**：\n- 友谊概念发展\n- 同伴接纳重要性增加\n\n**道德发展**（科尔伯格）：\n\n| 水平 | 阶段 | 特征 |\n|------|------|------|\n| 前习俗 | 1-2 | 避罚→利己 |\n| 习俗 | 3-4 | 好孩子→维护权威 |\n| 后习俗 | 5-6 | 社会契约→普遍伦理 |\n\n---",
      "first_definition": "",
      "id": "03-007"
    },
    {
      "title": "生理发展",
      "section": "四、青少年期发展（12-18岁）",
      "level": 3,
      "raw": "**青春期变化**：\n- 身体快速发育\n- 性成熟\n- 大脑前额叶未成熟（风险行为）\n\n---",
      "first_definition": "",
      "id": "03-008"
    },
    {
      "title": "认知发展（形式运算阶段）",
      "section": "四、青少年期发展（12-18岁）",
      "level": 3,
      "raw": "**核心能力**：\n- 抽象思维\n- 假设演绎推理\n- 元认知发展\n\n---",
      "first_definition": "",
      "id": "03-009"
    },
    {
      "title": "社会情感发展",
      "section": "四、青少年期发展（12-18岁）",
      "level": 3,
      "raw": "**自我同一性**（埃里克森）：\n\n| 状态 | 特征 |\n|------|------|\n| 同一性获得 | 经过探索，做出承诺 |\n| 同一性延缓 | 正在探索，未做承诺 |\n| 同一性早闭 | 未探索，接受他人承诺 |\n| 同一性扩散 | 未探索，未做承诺 |\n\n**同伴关系**：\n- 同伴重要性超过父母\n- 同伴群体形成\n\n---",
      "first_definition": "",
      "id": "03-010"
    },
    {
      "title": "认知发展",
      "section": "五、成年早期发展（18-40岁）",
      "level": 3,
      "raw": "**后形式思维**：\n- 接受不确定性\n- 辩证思维\n- 实用主义\n\n---",
      "first_definition": "",
      "id": "03-011"
    },
    {
      "title": "社会情感发展",
      "section": "五、成年早期发展（18-40岁）",
      "level": 3,
      "raw": "**亲密关系**（埃里克森：亲密 vs 孤独）：\n- 建立深度亲密关系\n- 友谊从共享活动到共享情感\n\n**职业发展**（舒伯）：\n- 探索期→建立期→维持期→衰退期\n\n**家庭生活周期**：\n- 结婚→育儿→空巢\n\n---",
      "first_definition": "",
      "id": "03-012"
    },
    {
      "title": "生理发展",
      "section": "六、中年期发展（40-65岁）",
      "level": 3,
      "raw": "**变化**：\n- 身体机能下降\n- 更年期（女/男）\n- 慢性病风险增加\n\n---",
      "first_definition": "",
      "id": "03-013"
    },
    {
      "title": "认知发展",
      "section": "六、中年期发展（40-65岁）",
      "level": 3,
      "raw": "**变化**：\n- 流体智力下降\n- 晶体智力稳定或上升\n- 专业知识补偿\n\n---",
      "first_definition": "",
      "id": "03-014"
    },
    {
      "title": "社会情感发展",
      "section": "六、中年期发展（40-65岁）",
      "level": 3,
      "raw": "**任务**（埃里克森：繁衍 vs 停滞）：\n- 关心下一代\n- 工作成就\n- 社区参与\n\n**关系变化**：\n- 子女独立\n- 父母衰老\n- 婚姻关系重新调整\n\n---",
      "first_definition": "",
      "id": "03-015"
    },
    {
      "title": "生理发展",
      "section": "七、老年期发展（65岁+）",
      "level": 3,
      "raw": "**变化**：\n- 身体机能进一步下降\n- 感官退化\n- 大脑萎缩\n\n---",
      "first_definition": "",
      "id": "03-016"
    },
    {
      "title": "认知发展",
      "section": "七、老年期发展（65岁+）",
      "level": 3,
      "raw": "**变化**：\n- 加工速度下降\n- 工作记忆下降\n- 晶体智力保持\n- 痴呆风险\n\n---",
      "first_definition": "",
      "id": "03-017"
    },
    {
      "title": "社会情感发展",
      "section": "七、老年期发展（65岁+）",
      "level": 3,
      "raw": "**任务**（埃里克森：完善 vs 绝望）：\n- 回顾一生，获得完善感\n- 接受死亡\n\n**社会支持**：\n- 社会网络缩小\n- 情感支持重要性增加\n\n**成功老龄化**：\n- 身体健康\n- 认知功能保持\n- 社会参与\n- 情绪调节\n\n---",
      "first_definition": "",
      "id": "03-018"
    },
    {
      "title": "教育应用",
      "section": "八、发展心理学应用",
      "level": 3,
      "raw": "**原则**：\n- 适应发展水平\n- 提供适当挑战\n- 考虑个体差异\n\n---",
      "first_definition": "",
      "id": "03-019"
    },
    {
      "title": "parenting 应用",
      "section": "八、发展心理学应用",
      "level": 3,
      "raw": "**教养方式**（鲍姆林德）：\n\n| 类型 | 要求 | 回应 | 结果 |\n|------|------|------|------|\n| 权威型 | 高 | 高 | 自信、独立 |\n| 专制型 | 高 | 低 | 顺从、低自尊 |\n| 溺爱型 | 低 | 高 | 冲动、依赖 |\n| 忽视型 | 低 | 低 | 问题行为 |\n\n---",
      "first_definition": "",
      "id": "03-020"
    },
    {
      "title": "政策应用",
      "section": "八、发展心理学应用",
      "level": 3,
      "raw": "**领域**：\n- 早期教育\n- 儿童保护\n- 老年服务\n- 终身教育\n\n---",
      "first_definition": "",
      "id": "03-021"
    },
    {
      "title": "皮亚杰认知发展阶段",
      "section": "九、发展心理学速查",
      "level": 3,
      "raw": "| 阶段 | 年龄 | 核心成就 |\n|------|------|----------|\n| 感觉运动 | 0-2 | 客体永久性 |\n| 前运算 | 2-7 | 符号思维 |\n| 具体运算 | 7-11 | 守恒、逻辑推理 |\n| 形式运算 | 11+ | 抽象思维、假设推理 |",
      "first_definition": "",
      "id": "03-022"
    },
    {
      "title": "埃里克森社会心理发展阶段",
      "section": "九、发展心理学速查",
      "level": 3,
      "raw": "| 阶段 | 年龄 | 危机 |\n|------|------|------|\n| 婴儿期 | 0-1 | 信任 vs 不信任 |\n| 幼儿期 | 1-3 | 自主 vs 羞愧 |\n| 学龄前 | 3-6 | 主动 vs 内疚 |\n| 学龄期 | 6-12 | 勤奋 vs 自卑 |\n| 青少年 | 12-18 | 同一性 vs 角色混乱 |\n| 成年早期 | 18-40 | 亲密 vs 孤独 |\n| 中年期 | 40-65 | 繁衍 vs 停滞 |\n| 老年期 | 65+ | 完善 vs 绝望 |",
      "first_definition": "",
      "id": "03-023"
    },
    {
      "title": "依恋类型",
      "section": "九、发展心理学速查",
      "level": 3,
      "raw": "| 类型 | 表现 |\n|------|------|\n| 安全型 | 分离焦虑但易安抚 |\n| 回避型 | 分离不焦虑，回避母亲 |\n| 矛盾型 | 分离极度焦虑难以安抚 |\n| 混乱型 | 行为混乱无序 |",
      "first_definition": "",
      "id": "03-024"
    }
  ]
}