{
  "category": "临床心理学",
  "category_id": "05",
  "source_file": "../_PsychologyLib/05_临床心理学/临床心理学.md",
  "concept_count": 20,
  "parsed_at": "2026-08-24T03:31:51+08:00",
  "schema_version": "0.1.0",
  "concepts": [
    {
      "title": "什么是临床心理学",
      "section": "一、临床心理学基本概念",
      "level": 3,
      "raw": "**定义**：研究心理障碍诊断、治疗、预防的心理学分支\n\n**工作内容**：\n\n| 内容 | 说明 |\n|------|------|\n| 心理评估 | 诊断心理障碍 |\n| 心理治疗 | 治疗心理痛苦 |\n| 心理预防 | 预防心理障碍 |\n| 心理康复 | 促进心理康复 |\n\n---",
      "first_definition": "研究心理障碍诊断、治疗、预防的心理学分支",
      "id": "05-001"
    },
    {
      "title": "心理障碍判断标准",
      "section": "一、临床心理学基本概念",
      "level": 3,
      "raw": "| 标准 | 说明 |\n|------|------|\n| 痛苦 | 主观痛苦感 |\n| 适应不良 | 适应功能受损 |\n| 非理性 | 思维行为非理性 |\n| 不可预测 | 行为不可预测 |\n| 非常态 | 偏离社会规范 |\n\n---",
      "first_definition": "",
      "id": "05-002"
    },
    {
      "title": "各类焦虑障碍",
      "section": "二、焦虑障碍",
      "level": 3,
      "raw": "| 障碍 | 特征 |\n|------|------|\n| 广泛性焦虑障碍 | 长期、过度担忧 |\n| 恐慌障碍 | 反复恐慌发作 |\n| 恐惧症 | 对特定事物恐惧 |\n| 强迫症 | 强迫思维和行为 |\n| 创伤后应激障碍 | 创伤事件后症状 |\n\n---",
      "first_definition": "",
      "id": "05-003"
    },
    {
      "title": "焦虑障碍治疗",
      "section": "二、焦虑障碍",
      "level": 3,
      "raw": "**心理治疗**：\n- 认知行为疗法（CBT）\n- 暴露疗法\n- 放松训练\n\n**药物治疗**：\n- 抗焦虑药\n- 抗抑郁药\n\n---",
      "first_definition": "",
      "id": "05-004"
    },
    {
      "title": "抑郁症",
      "section": "三、心境障碍",
      "level": 3,
      "raw": "**症状**：\n\n| 维度 | 表现 |\n|------|------|\n| 情绪 | 持续悲伤、兴趣丧失 |\n| 认知 | 无望、无价值、自杀意念 |\n| 行为 | 活动减少、迟缓 |\n| 生理 | 睡眠、食欲改变 |\n\n**治疗**：\n- 认知行为疗法\n- 人际心理治疗\n- 药物治疗（抗抑郁药）\n\n---",
      "first_definition": "",
      "id": "05-005"
    },
    {
      "title": "双相障碍",
      "section": "三、心境障碍",
      "level": 3,
      "raw": "**特征**：\n- 躁狂/轻躁狂发作\n- 抑郁发作\n- 发作间期可能正常\n\n**治疗**：\n- 药物治疗（心境稳定剂）\n- 心理治疗\n- 社会节律疗法\n\n---",
      "first_definition": "",
      "id": "05-006"
    },
    {
      "title": "症状",
      "section": "四、精神分裂症",
      "level": 3,
      "raw": "**阳性症状**（额外增加）：\n- 幻觉（常见听幻觉）\n- 妄想（固定错误信念）\n- 思维紊乱\n\n**阴性症状**（正常功能缺失）：\n- 情感平淡\n- 言语贫乏\n- 动机缺乏\n\n**认知症状**：\n- 注意力、记忆、执行功能受损\n\n---",
      "first_definition": "",
      "id": "05-007"
    },
    {
      "title": "治疗",
      "section": "四、精神分裂症",
      "level": 3,
      "raw": "**药物治疗**：\n- 抗精神病药\n\n**心理治疗**：\n- 社会技能训练\n- 认知矫正\n- 家庭干预\n\n**康复**：\n- 职业康复\n- 社区支持\n\n---",
      "first_definition": "",
      "id": "05-008"
    },
    {
      "title": "人格障碍类型（DSM-5）",
      "section": "五、人格障碍",
      "level": 3,
      "raw": "**A群（古怪型）**：\n\n| 障碍 | 特征 |\n|------|------|\n| 偏执型 | 猜疑、不信任 |\n| 分裂样 | 情感冷漠、 detachment |\n| 分裂型 | 认知扭曲、古怪行为 |\n\n**B群（戏剧型）**：\n\n| 障碍 | 特征 |\n|------|------|\n| 表演型 | 过度情绪化、寻求注意 |\n| 自恋型 | 夸大、需要赞美、缺乏共情 |\n| 边缘型 | 情绪不稳、人际关系不稳、自我形象不稳 |\n| 反社会型 | 无视他人权利、违法行为 |\n\n**C群（焦虑型）**：\n\n| 障碍 | 特征 |\n|------|------|\n| 回避型 | 社交抑制、自卑、对批评敏感 |\n| 依赖型 | 过分依赖、害怕分离 |\n| 强迫型 | 完美主义、控制、固执 |\n\n---",
      "first_definition": "",
      "id": "05-009"
    },
    {
      "title": "治疗",
      "section": "五、人格障碍",
      "level": 3,
      "raw": "**心理治疗**：\n- 辩证行为疗法（边缘型）\n- 认知行为疗法\n- 图式疗法\n\n**药物治疗**：\n- 针对伴随症状（焦虑、抑郁）\n\n---",
      "first_definition": "",
      "id": "05-010"
    },
    {
      "title": "神经性厌食症",
      "section": "六、进食障碍",
      "level": 3,
      "raw": "**特征**：\n- 拒绝维持正常体重\n- 恐惧体重增加\n- 体像扭曲\n\n**治疗**：\n- 营养康复\n- 心理治疗（家庭治疗、CBT）\n- 药物治疗（针对伴随症状）\n\n---",
      "first_definition": "",
      "id": "05-011"
    },
    {
      "title": "神经性贪食症",
      "section": "六、进食障碍",
      "level": 3,
      "raw": "**特征**：\n- 暴食发作\n- 清除行为（呕吐、泻药）\n- 对体重体型过度关注\n\n**治疗**：\n- 认知行为疗法\n- 人际心理治疗\n- 药物治疗（抗抑郁药）\n\n---",
      "first_definition": "",
      "id": "05-012"
    },
    {
      "title": "诊断标准",
      "section": "七、物质使用障碍",
      "level": 3,
      "raw": "**核心特征**：\n- 失控使用\n- 社交职业功能受损\n- 冒险使用\n- 耐受和戒断\n\n---",
      "first_definition": "",
      "id": "05-013"
    },
    {
      "title": "常见物质",
      "section": "七、物质使用障碍",
      "level": 3,
      "raw": "| 物质 | 效果 | 戒断症状 |\n|------|------|----------|\n| 酒精 | 抑制中枢 | 震颤、焦虑、癫痫 |\n| 尼古丁 | 兴奋 | 焦虑、易怒、渴求 |\n| 大麻 | 放松、欣快 | 睡眠障碍、烦躁 |\n| 可卡因 | 兴奋、欣快 | 抑郁、疲劳 |\n| 阿片类 | 镇痛、欣快 | 疼痛、腹泻、呕吐 |\n\n---",
      "first_definition": "",
      "id": "05-014"
    },
    {
      "title": "治疗",
      "section": "七、物质使用障碍",
      "level": 3,
      "raw": "** detoxification**：\n- 安全戒断\n\n**药物治疗**：\n- 替代治疗（美沙酮、丁丙诺啡）\n- 拮抗治疗（纳曲酮）\n\n**心理治疗**：\n- 动机访谈\n- 认知行为疗法\n- 互助小组（AA、NA）\n\n---",
      "first_definition": "",
      "id": "05-015"
    },
    {
      "title": "注意缺陷多动障碍（ADHD）",
      "section": "八、儿童青少年心理障碍",
      "level": 3,
      "raw": "**症状**：\n\n| 维度 | 表现 |\n|------|------|\n| 注意缺陷 | 难以集中注意、易分心 |\n| 多动 | 过度活动 |\n| 冲动 | 行为冲动、不计后果 |\n\n**治疗**：\n- 药物治疗（兴奋剂）\n- 行为治疗\n- 教育干预\n\n---",
      "first_definition": "",
      "id": "05-016"
    },
    {
      "title": "自闭症谱系障碍（ASD）",
      "section": "八、儿童青少年心理障碍",
      "level": 3,
      "raw": "**核心症状**：\n\n| 领域 | 表现 |\n|------|------|\n| 社会交流 | 社交互动缺陷 |\n| 局限行为 | 重复行为、狭窄兴趣 |\n\n**治疗**：\n- 行为干预（ABA）\n- 语言治疗\n- 教育干预\n- 家庭支持\n\n---",
      "first_definition": "",
      "id": "05-017"
    },
    {
      "title": "主要心理障碍",
      "section": "九、临床心理学速查",
      "level": 3,
      "raw": "| 障碍 | 核心特征 |\n|------|----------|\n| 焦虑障碍 | 过度焦虑、回避行为 |\n| 心境障碍 | 情绪极端变化 |\n| 精神分裂症 | 幻觉、妄想、思维紊乱 |\n| 人格障碍 | 人格模式僵化适应不良 |\n| 进食障碍 | 进食行为异常 |\n| 物质使用障碍 | 物质使用失控 |",
      "first_definition": "",
      "id": "05-018"
    },
    {
      "title": "心理治疗方法",
      "section": "九、临床心理学速查",
      "level": 3,
      "raw": "| 方法 | 适用 |\n|------|------|\n| 精神动力学治疗 | 深层人格问题 |\n| 认知行为疗法 | 焦虑、抑郁、强迫 |\n| 人本主义治疗 | 自我实现障碍 |\n| 家庭治疗 | 家庭系统问题 |\n| 团体治疗 | 人际问题 |",
      "first_definition": "",
      "id": "05-019"
    },
    {
      "title": "评估工具",
      "section": "九、临床心理学速查",
      "level": 3,
      "raw": "| 工具 | 用途 |\n|------|------|\n| 临床访谈 | 诊断 |\n| 心理测验 | 评估症状严重程度 |\n| 行为观察 | 评估行为问题 |\n| 生理测量 | 评估生理指标 |",
      "first_definition": "",
      "id": "05-020"
    }
  ]
}